family,scientificName,eventDate,year,month,day,startDayOfYear,habitat,substrate,verbatimAttributes,fieldNumber,informationWithheld,dataGeneralizations,reproductiveCondition,decimalLatitude,decimalLongitude,minimumElevationInMeters
Cyperaceae,Carex aquatilis,8/18/2012,,,,231,Wet Alpine Meadow near timberline,,"Perennial graminoid with rhizomes, 20-40 cm tall, abundant (dominant).",,,,"Fruit, disarticulating",37.851139,-107.776972,3581
Cyperaceae,Carex aquatilis,7/22/2013,,,,203,Small alpine tarn,,"Robust, rhizomatous graminoid growing at edge of tarn in water; common at site",,,,,37.399379,-106.668816,3702
Cyperaceae,Carex aquatilis,7/10/2004,,,,192,,,,,,,,37.4527778,-107.3088889,3444
Cyperaceae,Carex aquatilis,7/10/2004,,,,192,,,,,,,,37.4527778,-107.3088889,3444
Cyperaceae,Carex aquatilis,7/24/2004,2004,7,24,206,,,,,,,,37.71961,-107.55462,3733
Cyperaceae,Carex aquatilis,7/30/2004,2004,7,30,212,,,,,,,,37.55275,-107.60069,3657
Cyperaceae,Carex aquatilis,8/1/2004,2004,8,1,214,,,,,,,,37.61072,-107.61185,3535
Cyperaceae,Carex aquatilis,1986-07-00,1986,7,0,,Alpine ridge.,,,,,,Flowering,39.0203,-106.755,3850
Cyperaceae,Carex aquatilis,8/19/1985,1985,8,19,231,boggy gnd around sm lake,,,,,,,38.8047,-106.4149,3596
Cyperaceae,Carex aquatilis,8/20/1986,1986,8,20,232,moist humic soil,,,,,,,37.1213,-106.484,3505
Cyperaceae,Carex aquatilis,8/2/1945,1945,8,2,214,moist meadow,,,,,,,37.3154,-106.6199,3505
Cyperaceae,Carex aquatilis,8/19/1987,1987,8,19,231,wet meadow,,,,,,,37.1703,-105.1636,3611
Cyperaceae,Carex aquatilis,7/20/1968,1968,7,20,202,wet boggy gnd,,,,,,,39.9356,-105.6429,3200
Cyperaceae,Carex aquatilis,7/20/1968,1968,7,20,202,open boggy gnd,,,,,,,39.9356,-105.6429,3200
Cyperaceae,Carex aquatilis,7/9/1967,1967,7,9,190,"wet marsh, SE exposure",,,,,,,38.86515,-107.13324,3230
Cyperaceae,Carex aquatilis,8/21/1967,1967,8,21,233,"streambank, E exposure",,,,,,,39.10966,-106.27241,3352
Cyperaceae,Carex aquatilis,8/22/1968,1968,8,22,235,,,,,,,,40.4197,-105.8108,3505
Cyperaceae,Carex aquatilis,8/29/1987,1987,8,29,241,rocky soil of tundra,,,,,,,40.6215,-105.93678,3444
Cyperaceae,Carex aquatilis,8/13/1987,1987,8,13,225,wet meadow,,,,,,,37.18377,-105.15254,3779
Cyperaceae,Carex aquatilis,8/13/1987,1987,8,13,225,wet meadow,,,,,,,37.18377,-105.15254,3779
Cyperaceae,Carex aquatilis,8/16/1962,1962,8,16,228,silt loam of level near pond,,,,,,,39.0396,-108.051,3261
Cyperaceae,Carex aquatilis,1986-07-00,1986,7,0,,,,,,,,,39.0203,-106.7556,3850
Cyperaceae,Carex aquatilis,7/20/1996,1996,7,20,202,Talus with wet areas from run off.,,,,,,,37.7634,-107.587,3493
Cyperaceae,Carex aquatilis,7/21/1996,1996,7,21,203,Riparian community of mesic graminoids.,,,,,,,38.9776,-106.081,3231
Cyperaceae,Eriophorum angustifolium,7/21/1987,1987,7,21,202,Sedge bog.,,,,,,flowering and fruiting,38.8191,-106.3036,3415
Cyperaceae,Eriophorum angustifolium,8/21/2000,2000,8,21,234,Alpine and subalpine meadows.,,,,,,Phenology: Flowering and Fruiting.,39.1662,-106.5798,3536
Cyperaceae,Eriophorum angustifolium,8/28/2001,2001,8,28,240,Alpine meadow surrounding lake with willow carr.,,,,,,flowering and fruiting,38.6141,-106.251,3598
Cyperaceae,Eriophorum angustifolium,7/11/1997,1997,7,11,192,"Engelmann spruce/subalpine fir forest and wet basin; Salix, juniper.",,,,,,Phenology: Flowering.,38.992,-106.9341,3323
Cyperaceae,Eriophorum angustifolium,8/13/1987,1987,8,13,225,Wet meadow dominated by Carex with Salix and Veratrum and Plygonum on margins of pond surrounded by old growth Picea.,,,,,,flowering and fruiting,37.18693,-105.14807,3462
Cyperaceae,Eriophorum angustifolium,8/9/1934,1934,8,9,221,"Abundant in wet meadow on 10 degree slope, southeast exposure, in clay loam with Carex, Festuca, Poa and Caltha.",,,,,,fruiting,37.5458,-107.6604,3506
Cyperaceae,Eriophorum angustifolium,7/7/1988,1988,7,7,189,"At edge of small pond on rocky soil of steep northeast exposure with Phlox, Arenaria, Erigeron and Claytonia.",,,,,,fruiting,37.1703,-106.5917,3741
Cyperaceae,Eriophorum angustifolium,8/11/1943,1943,8,11,223,"Sparse in boggy area on 2% slope, northwest exposure, in deep humus with sedges and willows.",,,,,,fruiting,38.1403,-105.6845,3354
Cyperaceae,Eriophorum angustifolium,8/17/2011,2011,8,17,229,"Fens with peat moss and sedge meadows, bordered by spruce-fir forest.",,,,,,flowering and fruiting,39.2544,-106.5191,3399
Cyperaceae,Eriophorum angustifolium,8/17/2011,2011,8,17,229,"Fens with peat moss and sedge meadows, bordered by spruce-fir forest.",,,,,,flowering and fruiting,39.2544,-106.5191,3399
Cyperaceae,Eriophorum angustifolium,8/1/1995,1995,8,1,213,In a large open bog surrounded by Salix and Betula spp.,,,,,,Phenology: Flowering.,38.7742,-105.0266,3286
Cyperaceae,Carex aquatilis,8/18/2012,2012,8,18,231,Wet Alpine Meadow near timberline,,"Perennial graminoid with rhizomes, 20-40 cm tall, abundant (dominant).",,,,"Fruit, disarticulating",37.851139,-107.776972,3581
Cyperaceae,Carex aquatilis,7/22/2013,2013,7,22,203,Small alpine tarn,,"Robust, rhizomatous graminoid growing at edge of tarn in water; common at site",,,,,37.399379,-106.668816,3702
Cyperaceae,Carex aquatilis,7/16/2003,2003,7,16,197,large open marsh,,,,,,,37.192151,-106.593052,3597
Cyperaceae,Carex aquatilis,7/21/1981,1981,7,21,202,"Alpine tundra, in water.",,,,,,,40.05555,-105.58888,3480
Cyperaceae,Carex aquatilis,8/14/1972,1972,8,14,227,"Alpine tundra, in lee of terrace.",,,,,,,40.05,-105.61666,3475
Cyperaceae,Carex aquatilis,7/9/2004,2004,7,9,191,Small spring.,,,,,,,37.645,-107.35138,3283
Cyperaceae,Eriophorum angustifolium,7/9/2004,2004,7,9,191,"Large wet meadow with cottongrass, Pedicularis groenlandica, Carex spp., Eleocharis and scattered Salix.",,Cottongrass.,,,,,37.63972,-107.36388,3350
Cyperaceae,Carex aquatilis,8/31/1995,1995,8,31,243,"Wet meadow, nr pond and in water",,,,,,,39.01667,-107.03333,3599
Cyperaceae,Carex aquatilis,7/25/2011,2011,7,25,206,Edge of small pool in Sedge/willow wetland,,"Glaucous leaf tips, abundant",,,,,39.598782,-105.713985,3550
Cyperaceae,Carex aquatilis,7/25/2011,2011,7,25,206,Opening in sedge/willow wetland,,,,,,,39.598782,-105.713985,3550
Cyperaceae,Carex aquatilis,8/2/2012,2012,8,2,215,Common along Creek.,,,,,,,39.684091,-105.93258,3470
Cyperaceae,Carex aquatilis,8/2/2012,2012,8,2,215,Open area by streamlet and willows.,Wet soil.,Abundant.,,,,,39.685122,-105.932174,3465
Cyperaceae,Carex aquatilis,8/5/2012,2012,8,12,225,Wetland/meadow.,,Dominant sedge.,,,,,39.779174,-105.863926,3311
Cyperaceae,Carex aquatilis,8/4/2014,2014,8,4,216,Very wet upper subalpine sedge meadow along creek in spruce-willow forest.,Growing in moss.,,,,,Flower and fruit,38.14606,-107.44553,3385
Cyperaceae,Carex aquatilis,8/4/2014,2014,8,4,216,Very wet upper subalpine sedge meadow along creek in spruce-willow forest.,,,,,,Flower and fruit,38.14822,-107.4467,3385
Cyperaceae,Carex aquatilis,7/3/2015,2015,6,27,178,Spruce/fir subalpine forest.,,Glaucous leaf tips. Dominant sedge. Immature.,,,,Fruit,39.77346,-107.29654,3237
Cyperaceae,Carex aquatilis,8/17/2015,2015,8,17,229,Wet drainage in willow - spruce community.,,Locally common.,,,,Flower and fruit,38.06184,-107.42175,3484
CYPERACEAE,Carex aquatilis,7/12/1989,1989,7,12,193,"In seeping boggy areas along trail; with C. nova, C. chaciolepis, C. ebenea, Juncus mertensianus; igneous & metamorphic substrate.",,Common.,,,,,37.600526,-105.474671,3292
CYPERACEAE,Carex aquatilis,8/22/1990,1990,8,22,234,"Openings of  corridor of willow, dominated by Salix planifolia with Psycrophila leptosepala, Pedicularis groenlandica; glacial alluvium substrate of late Pindale origin.",,Dominant locally.,,,,,40.434087,-105.738059,3255
CYPERACEAE,Carex aquatilis,8/30/1995,1995,8,30,242,Lakeside; with C. canenscens.,,,,,,,39.594596,-105.704613,3508
CYPERACEAE,Carex aquatilis,8/15/1998,1998,8,15,227,Wet meadow with small pools of water surrounded by willow carr.,,Long rhizomatous,,,,,39.117667,-106.189913,3780
CYPERACEAE,Eriophorum angustifolium,7/24/2002,2002,7,24,205,"Large revegitating morainal kettle pond in Picea englemannii forest opening just W of Crater Lake.; in small areas of standing water bounded by Carex limosa, Eliocharis quinquiflora/Carex canescens fen, and with Menyanthes trifoliata; undivided Lower Miss",,occasional; forming patches,,,,,37.67351,-107.715028,3548
CYPERACEAE,Carex aquatilis,8/8/1970,1970,8,8,220,,,,,,,,40.430402,-105.768529,3658
CYPERACEAE,Carex aquatilis,8/11/1986,1986,8,11,223,Wet meadow with Caltha leptosepala dominant on floor of main basin,,,,,,,39.020354,-106.578783,3536
CYPERACEAE,Carex aquatilis,8/15/1984,1984,8,15,228,Wet meadow in lower part of basin,,,,,,,39.093431,-107.04935,3429
CYPERACEAE,Carex aquatilis,7/26/2006,2006,7,26,207,Moist picea forest,,,,,,,37.947761,-105.58789,3414
Cyperaceae,Eriophorum angustifolium,8/6/1992,1992,8,6,219,Marshland on the NE lake shore.,,,,,,,37.55,-107.6333333,3523
Cyperaceae,Carex aquatilis,7/19/1992,1992,7,19,201,At S end of sphagnum/iron bog. Immature.,,,,,,,37.895,-107.6469444,3265
Cyperaceae,Carex aquatilis,7/19/1992,1992,7,19,201,At S end of sphagnum/iron bog. Immature.,,,,,,,37.895,-107.6469444,3265
Cyperaceae,Carex aquatilis,8/9/2003,2003,8,9,221,,,,,,,,39.875278,-105.690833,3453
Ericaceae,Moneses uniflora,7/17/2003,2003,7,17,198,Alpine summit descending into north-facing spruce forest slope.,,,,,,flowering,37.7938,-107.3672,3843
Ericaceae,Moneses uniflora,7/26/2003,2003,7,26,207,Along creek in open meadow with scattered spruce and bristle cone pine.,,,,,,flowering,37.7765,-106.6597,3293
Ericaceae,Moneses uniflora,8/7/2003,2003,8,7,219,Along trail through spruce forest.,,,,,,flowering and fruiting,39.6565,-105.5949,3232
Ericaceae,Moneses uniflora,8/6/2004,2004,8,6,219,Along creek.,,,,,,flowering and fruiting,39.7361,-105.7482,3506
Ericaceae,Moneses uniflora,7/26/1997,1997,7,26,207,"Engelmann spruce, subalpine fir, and lodgepole pine forest.",,,,,,flowering,38.7183,-106.5076,3201
Ericaceae,Moneses uniflora,8/2/1997,1997,8,2,214,Engelmann spruce forest and open meadow.,,,,,,flowering,38.9055,-106.7672,3293
Ericaceae,Moneses uniflora,8/9/1998,1998,8,9,221,Engelmann spruce/subalpine fir forest.,,,,,,flowering,38.6646,-106.5438,3262
Ericaceae,Moneses uniflora,8/22/1998,1998,8,22,234,Engelmann spruce/subalpine fir.,,,,,,flowering,38.7196,-107.2286,3232
Ericaceae,Moneses uniflora,7/29/1998,1998,7,29,210,Engelmann spruce/subalpine fir forest and drainages on southeast slope.,,,,,,flowering,38.7342,-107.1728,3354
Ericaceae,Moneses uniflora,7/31/1998,1998,7,31,212,Alpine meadows into spruce forest.,,,,,,flowering,38.0373,-106.9277,3488
Ericaceae,Moneses uniflora,8/11/1998,1998,8,11,223,Mixed conifer/aspen forest to alpine.,,,,,,flowering,38.2438,-106.8815,3329
Ericaceae,Moneses uniflora,8/26/1999,1999,8,26,238,Canyon.,,,,,,flowering,38.0079,-106.8911,3415
Ericaceae,Moneses uniflora,8/11/1942,1942,8,11,223,Transition timber-meadow.,,,,,,flowering and fruiting,38.1403,-105.703,3506
Ericaceae,Moneses uniflora,8/11/1942,1942,8,11,223,5% north slope; sandy soil; common in timber/meadow transition.,,,,,,flowering,38.1403,-105.703,3506
Ericaceae,Moneses uniflora,7/29/1998,1998,7,29,210,Alpine-subalpine grassland; shade of Picea.,,,,,,flowering,37.6383,-105.4936,3598
Ericaceae,Moneses uniflora,7/30/1999,1999,7,30,211,Moist Picea forest.,,,,,,fruiting,38.4304,-106.0369,3201
Ericaceae,Moneses uniflora,7/10/1998,1998,7,10,191,Riparian.,,,,,,flowering,37.8736,-105.4583,3384
Ericaceae,Moneses uniflora,7/24/1998,1998,7,24,205,Alpine slope and timberline.,,,,,,flowering,38.224,-105.7031,3232
Ericaceae,Moneses uniflora,7/31/1998,1998,7,31,212,Areas with Picea and alpine around lakes,,,,,,flowering,38.3484,-105.87,3354
Ericaceae,Moneses uniflora,8/10/1998,1998,8,10,222,Picea engelmannii and alpine.,,,,,,flowering and fruiting,37.5694,-105.5042,3598
Ericaceae,Moneses uniflora,7/24/1998,1998,7,24,205,Spruce/corkbark fir forest.,,,,,,flowering,37.3019,-105.1467,3323
Ericaceae,Moneses uniflora,8/4/1999,1999,8,4,216,Pinus aristata.,,,,,,flowering,38.2931,-106.1112,3415
Ericaceae,Moneses uniflora,8/17/1999,1999,8,17,229,"Picea engelmannii, Abies lasiocarpa.",,,,,,fruiting,37.6083,-105.475,3232
Ericaceae,Moneses uniflora,8/7/2010,2010,8,7,219,Forested subalpine riparian corridor.,,,,,,flowering,39.5259,-106.1071,3201
Ericaceae,Moneses uniflora,8/24/2010,2010,8,24,236,"Subalpine ditch, seeps, springs, wet meadows, and fen.",,,,,,flowering and fruiting,39.3631,-106.3615,3223
Ericaceae,Moneses uniflora,8/5/2011,2011,8,5,217,"Fen dominated by Betula glandulosa, willows, and peat moss.",,,,,,flowering,39.0096,-106.8613,3902
Ericaceae,Moneses uniflora,8/18/1999,1999,8,18,230,Along road.,,,,,,fruiting,38.46,-106.0159,3354
Ericaceae,Moneses uniflora,8/14/2014,2014,7,19,200,"Roadside spring producing wet ditch with running water, spruce/fir forest.",Several plants on moist bank above stream/ditch.,Flowers white.,,,,Flower,37.34491,-105.03351,3399
ERICACEAE,Moneses uniflora,8/8/1912,1912,8,8,221,,,,,,,,38.9984,-105.500278,3353
ERICACEAE,Moneses uniflora,7/31/1965,1965,7,31,212,Growing under spruce and firs on SW slope of lake- dense foilage area with little shrub cover.,,,,,,,40.080162,-105.539702,3200
ERICACEAE,Moneses uniflora,7/28/1984,1984,7,28,210,Moist subalpine forest,,,,,,,40.66478,-105.466127,3200
HELLEBORACEAE,Aquilegia coerulea,8/9/1995,1995,8,9,221,On margin of large mesic meadow bounded by open forest of Pinus aristata and Populus tremuloides; relatively common.,,"Spur, sepals blue, petals white.",,,,,39.024781,-106.097933,3231
Liliaceae,Erythronium grandiflorum,6/29/2003,2003,6,29,180,,,,,,,,37.55405,-107.01724,3384
Liliaceae,Erythronium grandiflorum,6/22/1968,1968,6,22,174,,,,,,,Flowering,40.0125,-105.684,3201
Liliaceae,Erythronium grandiflorum,7/11/1995,1995,7,11,192,Along ridge crest and S and W facing slopes,,"herbaceous, terrestrial, white-green stems, green leaves, yellow petals, yellow anthers.",,,,,39.01667,-107.03333,3721
Liliaceae,Erythronium grandiflorum,7/10/2011,2011,7,10,191,"Bench at bottom of snowfields in bowl. On recently exposed snowmelt banks. Soil very loose, wet, and muddy.",,Some very large plants with 2-3 flowers. Could not dig deep enough to recover bulbs. Full bloom. Very Common.,,,,Full bloom.,38.9983082,-107.0323276,3292
Liliaceae,Erythronium grandiflorum,7/4/2015,2015,7,4,185,"Open, dry area among willows.",,,,,,Fruit,39.76599,-107.3166,3252
LILIACEAE,Erythronium grandiflorum,7/7/1981,1981,7,7,188,Rocky slopes to sod slopes leading to lake and interrupted by several dranage rivulets.,,,,,,,39.020252,-107.086424,3621
LILIACEAE,Erythronium grandiflorum,7/14/2009,2009,7,14,195,"At treeline on bench below solifluction lobe in loose, dlumping light colored rocky soil and above Salix planifolia thicket; with Juncus drummondii, Potentilla diversifolia, Noccea montana, Bistorta bistortoides, Viola labradorica, Sibbaldia procumbens, O",,tepals lemon yellow;>100 mostly immature plants confined to 100 sq. ft. area; only ±12 plants bloomed this year.,,,,,39.722842,-105.840449,3571
LILIACEAE,Erythronium grandiflorum,8/15/1957,1957,8,15,227,,,,,,,,40.023497,-105.680598,3353
Orobanchaceae,Castilleja miniata,8/8/2001,2001,8,8,220,Rolling tundra with tree islands of Picea with many ponds.,,Bracts & calyx red.,,,,,37.24611,-106.65083,3509
Orobanchaceae,Castilleja miniata,7/11/2013,2013,7,11,192,,,,,,,In flower,39.005077,-106.942012,3459
Orobanchaceae,Castilleja miniata,7/12/2013,2013,7,12,193,Plants are down trail to left on slope.,,,,,,In flower,39.0205,-107.043,3383
Orobanchaceae,Castilleja miniata,8/10/2014,2014,8,10,222,"Open, rocky shelves near camp. Growing in association with shrubs and in wetter areas.",,Bracts wide. Bracts and calyx red to red-orange. Fairly common.,,,,Flowers,39.00169,-107.03088,3505
Orobanchaceae,Castilleja miniata,8/10/2014,2014,8,10,222,"Open, rocky shelves near camp.",,"Same as CFW-1413? Bracts and calyx are more orange than most plants, which are typically redder. Bracts wider than typical?",,,,Flowers,39.00169,-107.03088,3505
Orobanchaceae,Castilleja miniata,8/6/2014,2014,8,6,218,Willow thicket and below west of Baldy Cinco mountain.,,,,,,Flower and fruit,37.93984,-107.14568,3519
Orobanchaceae,Castilleja miniata,7/4/2015,2015,7,4,185,Rock outcrop.,,Inflorescence red.,,,,Flower,39.76599,-107.3166,3252
Phrymaceae,Mimulus guttatus,7/8/2003,2003,7,8,189,Along small stream in spruce forest.,,,,,,flowering,37.5637,-106.5534,3390
Phrymaceae,Mimulus guttatus,7/8/2003,2003,7,8,189,Large seep area in spruce-aspen forest.,,,,,,flowering,37.5458,-106.5534,3220
Phrymaceae,Mimulus guttatus,7/13/2003,2003,7,13,194,"Dry, rocky drainage channel.",,,,,,flowering,37.7223,-107.1345,3201
Phrymaceae,Mimulus guttatus,7/17/2003,2003,7,17,198,Seep.,,,,,,flowering,37.7938,-107.3672,3843
Phrymaceae,Mimulus guttatus,7/26/2003,2003,7,26,207,Along creek in open meadow with scattered spruce and bristle cone pine.,,,,,,flowering,37.7765,-106.6597,3293
Phrymaceae,Mimulus guttatus,8/1/2003,2003,8,1,213,Alpine mesic meadow and drainage.,,,,,,flowering,37.7904,-107.5577,3720
Phrymaceae,Mimulus guttatus,8/3/2003,2003,8,3,215,Summit with rocky outcrops dropping into mesic meadow along creek.,,,,,,flowering,37.4432,-106.5979,3646
Phrymaceae,Mimulus guttatus,8/12/2003,2003,8,12,224,Alpine meadow with alpine lake.,,,,,,flowering,37.363,-106.6701,3351
Phrymaceae,Mimulus guttatus,7/10/2003,2003,7,10,191,Subalpine north-facing rocky slope into mesic meadow.,,,,,,flowering,37.5912,-106.8547,3811
Phrymaceae,Mimulus guttatus,6/9/2004,2004,6,9,161,Mesic aspen forest and lake shore.,,,,,,flowering,37.1333,-106.7932,3228
Phrymaceae,Mimulus guttatus,7/5/2004,2004,7,5,187,Seep and open mesic meadow.,,,,,,flowering,37.4602,-106.4146,3419
Phrymaceae,Mimulus guttatus,7/25/2004,2004,7,25,207,Subalpine mesic meadow in willow carr.,,,,,,flowering,37.6708,-106.9152,3515
Phrymaceae,Mimulus guttatus,8/16/2004,2004,8,16,229,Subalpine mesic meadow with lakes and streams.,,,,,,flowering,37.1125,-106.5181,3523
Phrymaceae,Mimulus guttatus,8/5/2004,2004,8,5,218,Wet meadow adjacent to stream and spruce stands.,,,,,,flowering,39.675,-105.9072,3476
Phrymaceae,Mimulus guttatus,8/6/2004,2004,8,6,219,Alpine drainage and stream.,,,,,,flowering,39.7361,-105.7482,3506
Phrymaceae,Mimulus guttatus,8/23/2004,2004,8,23,236,Along creek and road.,,,,,,fruiting,39.6167,-105.7158,3262
Phrymaceae,Mimulus guttatus,7/25/2001,2001,7,25,206,Willow carr surrounded by lodgepole and spruce.,,,,,,flowering,39.0208,-106.5632,3415
Phrymaceae,Mimulus guttatus,8/3/2001,2001,8,3,215,Willow carr and spruce krummholz.,,,,,,flowering,38.92,-106.285,3659
Phrymaceae,Mimulus guttatus,7/28/1998,1998,7,28,209,Steep north- and east-facing alpine slopes with intermittent open spruce forest at the lower elevation.,,,,,,flowering,37.9217,-107.5131,3476
Phrymaceae,Mimulus guttatus,8/9/1998,1998,8,9,221,Spruce forest to alpine tundra with rock outcrops.,,,,,,flowering,38.0643,-107.4224,3491
Phrymaceae,Mimulus guttatus,8/15/1998,1998,8,15,227,Forest and subalpine meadow.,,,,,,flowering,38.3613,-106.2595,3287
Phrymaceae,Mimulus guttatus,8/19/1998,1998,8,19,231,Spruce forest and riparian.,,,,,,flowering,38.1942,-107.4219,3256
Phrymaceae,Mimulus guttatus,8/20/1998,1998,8,20,232,Alpine tundra.,,,,,,flowering,37.9361,-107.4216,3598
Phrymaceae,Mimulus guttatus,8/11/1999,1999,8,11,223,Alpine tundra.,,,,,,flowering,37.9645,-107.0375,3537
Phrymaceae,Mimulus guttatus,8/27/1999,1999,8,27,239,Krummholtz to alpine tundra.,,,,,,flowering,38.0079,-106.9094,3720
Phrymaceae,Mimulus guttatus,8/3/2001,2001,8,3,215,Subalpine creek crossing with Sibbaldia and Salix and subalpine meadow.,,,,,,flowering,40.5939,-105.7232,3232
Phrymaceae,Mimulus guttatus,8/9/2001,2001,8,9,221,Subalpine creekside with Salix.,,,,,,flowering,40.52,-105.8453,3323
Phrymaceae,Mimulus guttatus,8/8/2000,2000,8,8,221,Rocky slopes.,,,,,,flowering,40.561,-105.9229,3354
Phrymaceae,Mimulus guttatus,7/10/2001,2001,7,10,191,Alpine.,,,,,,flowering and fruiting,40.402472,-105.916444,3476
Phrymaceae,Mimulus guttatus,7/27/2001,2001,7,27,208,"Steep, east facing subalpine creek edged with spruce-fir forest.",,,,,,flowering,40.4887,-105.8868,3201
Phrymaceae,Mimulus guttatus,8/14/2001,2001,8,14,226,"Steep, east facing alpine talus slopes of granite and krummholz.",,,,,,flowering,40.4887,-105.8868,3506
Phrymaceae,Mimulus guttatus,8/8/1936,1936,8,8,221,Wet rocky soil.,,,,,,flowering,39.10829,-106.56998,3661
Phrymaceae,Mimulus guttatus,7/12/1998,1998,7,12,193,Spruce-fir.,,,,,,flowering and fruiting,38.0916,-105.6269,3476
Phrymaceae,Mimulus guttatus,7/16/1998,1998,7,16,197,Picea engelmannii and Pinus contorta.,,,,,,flowering,38.3898,-106.241,3293
Phrymaceae,Mimulus guttatus,7/16/1998,1998,7,16,197,Picea engelmannii and alpine ridge.,,,,,,flowering,38.4036,-106.241,3415
Phrymaceae,Mimulus guttatus,7/27/1998,1998,7,27,208,Mixed conifers.,,,,,,flowering,38.3444,-106.1875,3293
Phrymaceae,Mimulus guttatus,8/10/1998,1998,8,10,222,Picea engelmannii and alpine.,,,,,,flowering,37.5694,-105.5042,3598
Phrymaceae,Mimulus guttatus,8/5/2010,2010,8,5,217,Riparian meadow with scattered pine and spruce.,,,,,,flowering,39.4442,-105.9968,3317
Phrymaceae,Mimulus guttatus,8/7/2010,2010,8,7,219,Forested subalpine riparian corridor.,,,,,,flowering,39.5259,-106.1071,3201
Phrymaceae,Mimulus guttatus,7/16/1999,1999,7,16,197,"Picea engelmannii, Abies lasiocarpa.",,,,,,flowering and fruiting,37.933,-105.4932,3354
Phrymaceae,Mimulus guttatus,8/19/2012,2012,8,19,232,Trailside. Mostly bare gravel and scree with some wet seeps. Plants growing in rocky seeps.,,"Low and spreading. Relatively few-flowered. Leaves deltoid-ovate with short petioles, and toothed margins. Does not appear to be rhizomatous. Flowers deep yellow with red spots.",,,,Full bloom.,38.9908,-107.065,3475
Phrymaceae,Mimulus guttatus,8/13/2014,2014,7,19,200,"Streamside, spruce/fir forest.",Wet soil.,"Throat open, hairy, spots.",,,,Flower,37.3151,-105.13998,3200
Phrymaceae,Mimulus guttatus,8/14/2014,2014,7,19,200,Lake shore.,,,,,,Flower,37.32343,-105.14173,3209
Phrymaceae,Mimulus guttatus,8/14/2014,2014,7,19,200,"Small wetland at N end of pond, spruce/fir forest.",Moist/wet soil.,Flowers yellow.,,,,Flower,37.32265,-105.14039,3202
Phrymaceae,Mimulus guttatus,8/4/2014,2014,8,4,216,Very wet upper subalpine sedge meadow along creek in spruce-willow forest.,Growing on rocky bar in Little Cimarron River.,,,,,Flower,38.14606,-107.44553,3385
Phrymaceae,Mimulus guttatus,8/19/2015,2015,8,19,231,Subalpine drainage; wet meadows.,,Growing in slow-flowing stream.,,,,Flower,38.07762,-107.42403,3661
Phrymaceae,Mimulus guttatus,10/14/2011,2011,10,14,287,"In and along stream and pond with willow, spruce and aspen - sub-alpine to alpine Ponderosa pine woods",,,,,,FR,39.41786944,-105.9654694,3512
Poaceae,Deschampsia cespitosa,7/20/2006,,,,201,Alpine tundra,Granite,,,,,,37.58305556,-107.6166667,3671
Poaceae,Calamagrostis canadensis,7/24/2003,2003,7,24,205,,,,,,,,37.68334,-107.56307,3750
Poaceae,Deschampsia cespitosa,8/26/1981,1981,8,26,238,"Timberline, Streamside.",,,,,,,37.8977422,-107.7334843,3535
Poaceae,Deschampsia cespitosa,8/19/1975,1975,8,19,231,,,,,,,Fertile,37.7494,-107.683,3201
Poaceae,Deschampsia cespitosa,7/6/1989,1989,7,6,187,Mtn meadows at and above timberline. Subalpine fir and Engelmann spruce krumholz at Twin Lakes.,,,,,,Fertile,37.2772,-106.577,3354
Poaceae,Deschampsia cespitosa,8/17/2005,2005,8,17,229,"Rocky pavement, talus and grassy slopes.",,,,,,,37.7964,-107.55,3901
Poaceae,Calamagrostis canadensis,8/20/1986,1986,8,20,232,moist SW expos,,,,,,,37.1006,-106.4544,3352
Poaceae,Calamagrostis canadensis,8/4/1945,1945,8,4,216,meadow edge,,,,,,,37.2437,-106.6326,3444
Poaceae,Calamagrostis canadensis,8/16/1987,1987,8,16,228,E expos,,,,,,,37.2286,-105.1636,3840
Poaceae,Calamagrostis canadensis,9/5/1967,1967,9,5,248,flat wet marsh,,,,,,,38.86515,-107.13324,3230
Poaceae,Calamagrostis canadensis,8/18/1960,1960,8,18,231,,,,,,,,40.5052,-105.9709,3474
Poaceae,Calamagrostis canadensis,8/24/1984,1984,8,24,237,silty loam of gentle NE expos,,,,,,,37.5685,-106.4663,3353
Poaceae,Calamagrostis canadensis,8/27/1955,1955,8,27,239,,,,,,,,38.0614,-106.8493,3413
Poaceae,Calamagrostis canadensis,8/4/1972,1972,8,4,217,sandy soil of streamedge,,,,,,,39.3683,-106.0432,3383
Poaceae,Calamagrostis canadensis,7/30/1994,1994,7,30,211,Large fish hook shaped masrh area with Picea engelmannii/Salix planifolia/Carex retrorsa-Carex aquatilis-Psychrophila.,,,,,,,37.5291,-107.3184,3377
Poaceae,Calamagrostis canadensis,8/16/1994,1994,8,16,228,Meadow on lowest terrace next to stream.,,,,,,,37.4716,-107.0547,3338
Poaceae,Deschampsia cespitosa,7/25/1989,1989,7,25,206,Alpine.,,,,,,Phenology: not specified.,40.6625,-106.6635,3414
Poaceae,Deschampsia cespitosa,7/25/1989,1989,7,25,206,Alpine.,,,,,,Phenology: not specified.,40.6625,-106.6635,3414
Poaceae,Calamagrostis canadensis,8/22/1998,1998,8,22,234,Engelmann spruce/subalpine fir and along pond.,,,,,,Phenology: Flowering.,38.7196,-107.2286,3246
Poaceae,Calamagrostis canadensis,7/30/1998,1998,7,30,211,Engelmann spruce forest and open wet meadow.,,,,,,Phenology: Flowering.,38.7039,-107.1381,3323
Poaceae,Calamagrostis canadensis,7/11/1994,1994,7,11,192,In boggy spruce-fir forest.,,,,,,Phenology: Flowering and Fruiting.,37.9009,-108.2326,3292
Poaceae,Calamagrostis canadensis,8/6/1994,1994,8,6,218,Meadow and timberline.,,,,,,Phenology: Flowering and Fruiting.,37.8284,-107.866,3597
Poaceae,Calamagrostis canadensis,8/6/1994,1994,8,6,218,Lake.,,,,,,Phenology: Flowering and Fruiting.,37.8284,-107.866,3597
Poaceae,Calamagrostis canadensis,8/11/1994,1994,8,11,223,Spruce-fir forest and wetlands (open wet meadows).,,,,,,Phenology: Flowering and Fruiting.,37.8574,-108.141,3597
Poaceae,Calamagrostis canadensis,8/7/1994,1994,8,7,219,Montane spruce-fir forest and seepage. North-northwest facing.,,,,,,Phenology: Flowering and Fruiting.,37.8139,-108.2143,3353
Poaceae,Calamagrostis canadensis,8/15/1994,1994,8,15,227,West facing subalpine riparian meadow surrounded by scattered spruce.,,,,,,Phenology: Flowering and Fruiting.,37.7132,-107.9144,3414
Poaceae,Calamagrostis canadensis,8/17/1995,1995,8,17,229,Subalpine spruce-fir forest on west face.,,,,,,Phenology: Flowering and Fruiting.,37.5815,-108.0232,3231
Poaceae,Calamagrostis canadensis,8/8/1991,1991,8,8,220,"Edges of shallow lake, with sedges, grasses, Pedicularis, and aquatics.",,,,,,Phenology: not specified.,39.8478,-107.2681,3201
Poaceae,Calamagrostis canadensis,8/21/1991,1991,8,21,233,"Open spruce-fir forest and clearings, ""silver forest"", with willows and currants understory.",,,,,,Phenology: not specified.,40.0686,-107.1267,3292
Poaceae,Calamagrostis canadensis,8/22/1991,1991,8,22,234,Boggy area.,,,,,,Phenology: not specified.,40.0244,-107.1458,3262
Poaceae,Calamagrostis canadensis,8/24/1991,1991,8,24,236,"Base of sheer cliffs, rocky terrain, and wet areas with melting snow and small lakes.",,,,,,Phenology: not specified.,39.7896,-107.3998,3353
Poaceae,Calamagrostis canadensis,8/10/1998,1998,8,10,222,Picea engelmannii and alpine.,,,,,,flowering and fruiting,37.5694,-105.5042,3598
Poaceae,Calamagrostis canadensis,8/8/1991,1991,8,8,220,"Edges of shallow lake, with sedges, grasses, Pedicularis, and aquatics.",,,,,,,39.8478,-107.2681,3201
Poaceae,Calamagrostis canadensis,8/8/2001,2001,8,8,220,Rolling tundra with tree islands of Picea with many ponds.,,,,,,,37.24611,-106.65083,3509
Poaceae,Calamagrostis canadensis,8/17/1972,1972,8,17,230,Alpine tundra.,,,,,,,40.05,-105.61666,3475
Poaceae,Deschampsia cespitosa,7/21/2013,2013,7,21,202,"Streamside wet meadow. Very wet, lush vegetation.",,"Bunch grass. Panicle, with ~5 branches/node. Spikelets not crowded, on long peduncles. Glumes 1-nerved, with purple margins, green base, pale tip. Lemmas and awns with much purple. Lemmas 5-nerved, awned from near base, glabrous, ~ 4-5 mm long. 2 fls/spklet, rachilla hairy, extending well beyond base of distal lemma.",,,,Flowers,38.9816,-106.973,3579
Poaceae,Deschampsia cespitosa,7/14/2014,2014,7,14,195,Wet areas.,,"Inflorescence paniculate, 2 fl/spklt. Lemma 5-nerved, <3mm, awned from the base. rachilla pubescent. Glumes purple-tinged on margins with green mid-nerve. Incidental collection with Carex.",,,,Flowers,39.03228,-107.07114,3304
Poaceae,Deschampsia cespitosa,7/14/2014,2014,7,14,195,"Plants among rocks and on low, meadow ""islands"" among rocks. Spruce band above near cliffs. Lots of low willow among rocks and scree.",,"Inflorescence paniculate, 2 fl/spklt. Lemma 5-nerved, <3mm, awned from the base. rachilla pubescent. Glumes purple-tinged on margins with green mid-nerve.",,,,Flowers,39.03247,-107.06977,3304
Poaceae,Deschampsia cespitosa,8/29/2014,2014,8,29,241,Gravelly outwash moraines with lots of bare soil/rock. Much drier than adjacent swales with Caltha and Castilleja rhexiifolia. All plants of small stature on moraine.,,"Plants 3-4dm tall. Inflorescence a panicle. 2-3 florets/spikelet. Florets perfect. Lemmas with geniculate awn from base. Rachillas very hairy, extending well beyond terminal floret. Lemmas green at base, purple mid-section and erose papery tan at apex.",,,,Flowers,39.017578,-107.09066,3627
Poaceae,Calamagrostis canadensis,9/9/1995,1995,9,9,252,"Tundra, W facing slope",,"terrestrial, herbaceous, green stems, green leaves, large dense clumps.",,,,,39,-106.15,3599
Poaceae,Calamagrostis canadensis,8/13/2014,2014,7,19,200,Edge of meadow in spruce/fir forest.,,,,,,,37.31573,-105.14009,3200
Poaceae,Calamagrostis canadensis,8/14/2014,2014,7,19,200,"Small wetland at N end of pond, spruce/fir forest.",wet soil.,,,,,Flower/Fruit,37.32265,-105.14039,3202
Poaceae,Calamagrostis canadensis,8/17/2015,2015,8,17,229,Wet drainage in willow - spruce community.,,Common.,,,,Flower,38.06184,-107.42175,3484
Poaceae,Calamagrostis canadensis,8/19/2015,2015,8,19,231,Subalpine drainage; wet meadows.,,Large colonies on wetland bank.,,,,Flower,38.07762,-107.42403,3661
POACEAE,Deschampsia cespitosa,8/13/1982,1982,8,13,225,wet meadow,,,,,,,38.843736,-106.520958,3200
POACEAE,Calamagrostis canadensis,8/23/1949,1949,8,23,235,Wet ground,,,,,,,37.743226,-107.68317,3200
POACEAE,Calamagrostis canadensis,9/5/1983,1983,9,5,248,wet area,,,,,,,39.797926,-105.774244,3446
POACEAE,Deschampsia cespitosa,7/14/1990,1990,7,14,195,"Forming clumps in openings on damp woil at upper edge of willow carr; glacial alluvium substrate; late Pinedale origin; common., with Salix planifolia, Vaccinium cespitosum, jBistorta bistortoides",,,,,,,40.428705,-105.734463,3255
POACEAE,Calamagrostis canadensis,8/22/1990,1990,8,22,234,"Wetlands, openings of corridor willow carr; locally common.",,,,,,,40.434087,-105.738059,3255
POACEAE,Deschampsia cespitosa,8/1/1992,1992,8,1,214,In openings in willow carr in damp soil; undivided Precambrian metamorphic & igneous rocks.,,Plant light green,,,,,40.520971,-105.672902,3429
POACEAE,Calamagrostis canadensis,8/12/1997,1997,8,12,224,Supalpine forest. Growing near streamlet with willows.,,,,,,,39.646748,-105.605351,3505
POACEAE,Deschampsia cespitosa,8/15/1998,1998,8,15,227,Wet meadow with pools of water surrounded by willow carr.,,,,,,,39.12047,-106.193115,3780
POACEAE,Deschampsia cespitosa,7/26/1997,1997,7,26,207,"Englemann spruce, subalpine fir forest around lake",,,,,,,38.704606,-106.525078,3459
POACEAE,Deschampsia cespitosa,8/20/1999,1999,8,20,232,Moist site; alpine vegetation.,,flowering/fruiting,,,,,37.566152,-105.510699,3658
POACEAE,Deschampsia cespitosa,8/22/1998,1998,8,22,234,West-facing ridge of peak; alpine tundra,,,,,,,38.718928,-107.210034,3566
POACEAE,Deschampsia cespitosa,7/24/2002,2002,7,24,205,"Large revegetating morainal kettle pond in Picea engelmannii forest opening just W of Crater L., in muck of outer edge; undivided Lower Mississippian, Upper Devonian, Upper Cambrian substrate; common.",,,,,,,37.67351,-107.715028,3548
POACEAE,Deschampsia cespitosa,8/4/1982,1982,8,4,216,moist-wet meadow adjacent to rivulet,,,,,,,37.910311,-107.517303,3688
POACEAE,Deschampsia cespitosa,8/17/1983,1983,8,17,229,fellfield on top of NE-facing ledge above mine adit,,,,,,,37.897461,-107.543701,3612
POACEAE,Deschampsia cespitosa,7/17/1982,1982,7,17,198,crevices of wet ledge on Niagara Mountain,,,,,,,39.623782,-105.713146,3597
POACEAE,Deschampsia cespitosa,7/12/2006,2006,7,12,193,"Alpine basin w/ limestone and hard rock; moist site w/ Carex scopulorum, C. chalciolepsis, Pedicularis groenlandica, Bistorta bistortoides",,,,,,,38.34833,-105.88111,3658
POACEAE,Deschampsia cespitosa,7/7/2007,2007,7,7,188,"Rolling volcanic tundra, open sites in Salix planifolia/S. brachycarpa",,,,,,,37.784042,-107.53405,3627
POACEAE,Deschampsia cespitosa,7/16/2009,2009,7,16,197,"On broad ridge above timberline in well developed 90% vegetated tundra; common associates include Acomastylis rossii ssp. turbinata, Allium geyeri, Potentilla subjuga, Tetraneuris brevifolia, Carex rupestris. Granitic substrate.",,Clumpgrass; common.,,,,,38.817904,-105.027944,3751
POACEAE,Calamagrostis canadensis,7/17/2009,2009,7,17,198,"Grassy Slope, near Pinus aristata timberline; associates inlude, Achillea lanulosa, Phleum commutatum, Danthonia intermedia, Sibbaldia procumbens; in Salix near Pinus engelmannii. Granitic substrate.",,Rhizomatous; relatively common.,,,,,38.812425,-105.025063,3576
POACEAE,Deschampsia cespitosa,7/7/1978,1978,7,7,188,,,,,,,,39.630551,-105.602937,3703
POACEAE,Deschampsia cespitosa,9/2/1937,1937,9,2,245,In sand by stream,,,,,,,38.874757,-105.074818,3429
POACEAE,Deschampsia cespitosa,7/14/2009,2009,7,14,195,"On bank of developing drainage in mixed mesic vegetation; with Acomastylis rossi ssp. turbinata, Carex nova, Carex ebenea, Salix planifolia, Phleum comutatum, Luzula spicata, Bistorta bistortoides, Rhodiola integrifolia, Antennaria media. Granitic substrate.",,Densely caespitose; locally common.,,,,,38.821704,-105.037127,3651
POACEAE,Deschampsia cespitosa,8/7/1949,1949,8,7,219,,,,,,,,39.276597,-106.157431,3475
POACEAE,Deschampsia cespitosa,7/25/1936,1936,7,25,207,moist grassland,,,,,,,39.652602,-105.780931,3505
POACEAE,Deschampsia cespitosa,7/14/2009,2009,7,14,195,"Well developed tundra on gentle SE facing slope; common associates include Carex ebenea, C. nova, C. scopulorum, Acomastylis rossii ssp. turbinata, Psychrophylla leptosepala, Luzula spicata, Sibbaldia procumbens, Bistora vivipara. Granitic substrate.",,Clump forming; locally common.,,,,,38.818913,-105.031505,3687
POACEAE,Deschampsia cespitosa,8/10/1995,1995,8,10,222,Well developed tundra & turf between rock ribbons streaming down moderate slope from ridge above; substrate of Tertiary andesite; realtively common.,,clump-forming,,,,,39.903148,-106.112526,3719
Polemoniaceae,Polemonium pulcherrimum,7/21/2015,2015,7,21,202,Alpine meadow,,,,,,,37.71685,-107.92455,3520
Polemoniaceae,Polemonium pulcherrimum,7/20/2010,2010,7,20,201,"Lake side, Englemann spruce forest",,,,,,,37.885667,-107.844833,3430
Polemoniaceae,Polemonium pulcherrimum,7/6/1989,1989,7,6,187,Mtn meadows at and above timberline. Subalpine fir and Engelmann spruce krumholz at Twin Lakes.,,,,,,Flowering,37.2772,-106.577,3354
Polemoniaceae,Polemonium pulcherrimum,7/17/1989,1989,7,17,198,"Alpine tundra, north facing slope, dry soil at edge of Krumholz",,,,,,Flower,40.05,-105.5683,3444
POLEMONIACEAE,Polemonium pulcherrimum,7/13/2000,2000,7,13,195,Northeast facing slope on lower edge of alpine tundra,,,,,,,40.51718,-105.90205,3383
POLEMONIACEAE,Polemonium pulcherrimum,7/2/1975,1975,7,2,183,,,,,,,,39.22396,-106.088959,3353
POLEMONIACEAE,Polemonium pulcherrimum,7/19/1972,1972,7,19,201,Under spruces,,,,,,,39.989615,-105.642124,3292
POLEMONIACEAE,Polemonium pulcherrimum,7/27/1961,1961,7,27,208,"Near far below timberline, upper third of trail, in dark, rich soil, mostly in shade of conifers.",,,,,,,39.63632,-105.593804,3566
POLEMONIACEAE,Polemonium pulcherrimum,8/12/1997,1997,8,12,224,"On windblown sandy ridge above treelilne, with many alpine flowers, in shade of ribes. soil: colluvial sandy cryochrept deried from porphyry.",,"Height: 15 cm. Fresh petals: light purplish blue, 10PB7/8.",,,,,37.72761,-108.061189,3627
POLEMONIACEAE,Polemonium pulcherrimum,6/28/1998,1998,6,28,179,In shade of Engelmann spruce,,Flowers light blue,,,,,38.976722,-106.081883,3292
POLEMONIACEAE,Polemonium pulcherrimum,6/23/2000,2000,6,23,175,"On timberline moraine at edge of Picea englemannii forest with common associates; Red arkose sandstone, conglomerate ss. silstone shale; common.",,Corolla pale blue with yellow throat.,,,,,38.883129,-107.008117,3551
POLEMONIACEAE,Polemonium pulcherrimum,6/16/2007,2007,6,16,167,"Boechera ssp, Castilleja ssp. and assorted taxa",,"perennials, up to 4 inches tall, having pale purplish-blue bell-shaped flowers scattered to common",,,,,39.628875,-105.711322,3200
POLEMONIACEAE,Polemonium pulcherrimum,6/30/2009,2009,6,30,181,"In grass among Saliz sp. in stony area on E. facing slope; with Acomastylis rossii ssp. turbinata, Micranthes rhomboidea. Granite substrate.",,Flowers pale blue; Uncommon.,,,,,38.812668,-105.027378,3598
POLEMONIACEAE,Polemonium pulcherrimum,8/17/2009,2009,8,17,229,"On drainage bench in shady subalpine Picea engelmanii forest; associates include Salix planifolia, Salix brachycarpa; Mertensia ciliata, Artemisia scopulorum, Acomastylis rossii, Bistorta bistortoides. Granitic substrate.",,Flowers blue; scattered locally.,,,,,38.832089,-105.023906,3493
POLEMONIACEAE,Polemonium pulcherrimum,8/17/2009,2009,8,17,229,"On drainage bench in shady subalpine Picea engelmanii forest; associates include Salix planifolia, Salix brachycarpa; Mertensia ciliata, Artemisia scopulorum, Acomastylis rossii, Bistorta bistortoides. Granitic substrate.",,Flowers yellow; scattered locally.,,,,,38.832089,-105.023906,3493
POLEMONIACEAE,Polemonium pulcherrimum,7/23/1995,1995,7,23,204,"Precambrian quartz monzonite, adamellite, quartz substrate. Boundary between dense Picea engelmannii forest & willow carr ; scattered patches locally; widspread in wetland/ forest margins.",,Flowers powder blue. Rhizomatous in spruce duff.,,,,,39.005978,-106.178023,3520
Polemoniaceae,Polemonium pulcherrimum,8/8/1974,1974,8,8,220,Abundant on shallow peat with graminoids and Salix species,,Perennial corolla blue,,,,Flowering,40.588167,-105.73818,3576
Polemoniaceae,Polemonium pulcherrimum,8/1/1988,1988,8,1,214,Sandy loam soil in an alpine meadow,,Blue flowering herbaceous perennial,,,,flowering,37.917721,-107.73556,3939
Polygonaceae,Oxyria digyna,7/21/2015,2015,7,21,202,"Rock outcrop in shallow soil, Spruce-fir forest near tree line",,,,,,,37.721833,-107.901883,3475
Polygonaceae,Oxyria digyna,7/22/2003,2003,7,22,203,,,,,,,,37.79321,-107.54825,3810
Polygonaceae,Oxyria digyna,7/31/2008,2008,7,31,213,Alpine tundra,,,,,,,37.85165,-107.776,3570
Polygonaceae,Oxyria digyna,7/27/2009,2009,7,27,208,Tree line - meadow adjacent to a spruce forest,,,,,,,37.8515,-107.786,3470
Polygonaceae,Oxyria digyna,8/8/1973,1973,8,8,220,,,,,,,Flowering & Fruiting,39.5822,-105.633,4146
Polygonaceae,Oxyria digyna,7/27/1976,1976,7,27,209,From lodgepole pine forest to above timberline.,,Above timberline.,,,,Fruiting,40.43,-105.81,3476
Polygonaceae,Oxyria digyna,1986-07-00,1986,7,0,,Alpine ridge.,,,,,,Flowering,39.0203,-106.755,3850
Polygonaceae,Oxyria digyna,7/16/1960,1960,7,16,198,Shale slope.,,,,,,Flowering,39.0444,-106.998,3659
Polygonaceae,Oxyria digyna,8/7/2010,2010,8,7,219,NNW facing slopes of high alpine basin. Very moist with several ephemeral streambeds. Along streams.,,Fruits with 2 valves (Rumex have 3). Leaves Kidney-shaped. Very common. Full bloom.,,,,Flower & fruit,38.96981,-106.9387,3910
Polygonaceae,Oxyria digyna,7/11/1971,1971,7,11,192,"peat-like shallow soil, steep fellfields",,,,,,,40.075,-105.5867,3901
Polygonaceae,Oxyria digyna,7/2/1959,1959,7,2,183,rocks in moist places,,,,,,,40.1514,-105.5309,3352
Polygonaceae,Oxyria digyna,7/20/1967,1967,7,20,201,rocky stony disturbed rdside site,,,,,,,39.6435,-105.5957,3596
Polygonaceae,Oxyria digyna,8/5/1961,1961,8,5,217,moist soil,,,,,,,39.6435,-105.5957,3657
Polygonaceae,Oxyria digyna,1892-07-18,1892,7,18,200,,,,,,,,39.6366,-105.8118,3505
Polygonaceae,Oxyria digyna,8/20/1985,1985,8,20,232,"moist granitic gravelly soil, tundra, steep N expos",,,,,,,37.2886,-106.5703,3983
Polygonaceae,Oxyria digyna,8/1/1945,1945,8,1,213,cliff side,,,,,,,37.326,-106.636,3505
Polygonaceae,Oxyria digyna,8/14/1987,1987,8,14,226,E expos,,,,,,,37.2286,-105.1636,3931
Polygonaceae,Oxyria digyna,7/7/1960,1960,7,7,189,,,,,,,,40.3608,-105.9484,3566
Polygonaceae,Oxyria digyna,8/6/1967,1967,8,6,218,"moist loam on alpine boulderfield, NE expos",,,,,,,38.86515,-107.13324,3688
Polygonaceae,Oxyria digyna,7/21/1981,1981,7,21,202,moist meadow by rivulet,,,,,,,37.9083,-107.5178,3730
Polygonaceae,Oxyria digyna,7/8/1960,1960,7,8,190,tundra,,,,,,,40.378,-105.9461,3718
Polygonaceae,Oxyria digyna,7/19/1934,1934,7,19,200,"barren slide, gravel soil, W expos",,,,,,,37.5893,-107.6053,3840
Polygonaceae,Oxyria digyna,7/27/1948,1948,7,27,209,,,,,,,,39.10863,-106.56447,3657
Polygonaceae,Oxyria digyna,7/29/1941,1941,7,29,210,E expos above timberline,,,,,,,40.4408,-105.7529,3535
Polygonaceae,Oxyria digyna,7/17/1959,1959,7,17,198,rockslide,,,,,,,40.5177,-105.8489,3352
Polygonaceae,Oxyria digyna,7/16/1959,1959,7,16,197,"protected gnd, rocks",,,,,,,40.5069,-105.8514,3352
Polygonaceae,Oxyria digyna,7/26/1944,1944,7,26,208,"soil pockets, rocks",,,,,,,40.5322,-105.8868,3505
Polygonaceae,Oxyria digyna,7/2/1972,1972,7,2,184,"rocky soil, S expos",,,,,,,39.3683,-106.0802,3560
Polygonaceae,Oxyria digyna,7/16/1985,1985,7,16,197,wet disturbed E expos,,,,,,,39.3249,-106.0987,3700
Polygonaceae,Oxyria digyna,1986-07-00,1986,7,0,,,,,,,,,39.0203,-106.7556,3850
Polygonaceae,Oxyria digyna,7/12/1987,1987,7,12,193,deep shaded draw,,,,,,,37.8783,-106.7813,3627
Polygonaceae,Oxyria digyna,8/11/1943,1943,8,11,223,"rock slides, open N expos",,,,,,,38.1403,-105.6845,3505
Polygonaceae,Oxyria digyna,7/12/1982,1982,7,12,193,"rock ledge crevices, S expos",,,,,,,37.8885,-107.52196,3840
Polygonaceae,Oxyria digyna,8/17/1979,1979,8,17,229,"sandy clay losm soil, basin above lake",,,,,,,37.82672,-107.79469,3780
Polygonaceae,Oxyria digyna,8/2/1972,1972,8,2,215,"loam, Steep W expos",,,,,,,39.3683,-106.0617,3474
Polygonaceae,Oxyria digyna,7/17/1999,1999,7,17,198,Infrequent by the side of the road in alpine tundra.,,,,,,,39.6253,-105.7819,3993
Polygonaceae,Oxyria digyna,7/26/1998,1998,7,26,207,Upper drainage in flats.  Alpine tundra.  Collected on top of mesa.,,,,,,,37.4716,-106.8964,3719
Polygonaceae,Oxyria digyna,7/23/1996,1996,7,23,205,Alpine,,,,,,,37.7916,-107.0557,3873
Polygonaceae,Oxyria digyna,8/15/1997,1997,8,15,227,Dry tundra,,,,,,,38.6423,-106.4319,3688
Polygonaceae,Oxyria digyna,7/4/2004,2004,7,4,186,Common on steep slope in rocky soil of alpine tundra.,,,,,,,39.85388889,-105.6638889,3505
Polygonaceae,Oxyria digyna,8/6/1996,1996,8,6,219,,,,,,,,37.7634,-107.587,3536
Polygonaceae,Oxyria digyna,8/10/2003,2003,8,10,222,Alpine.,,,,,,,39.8011,-105.7491,3536
Polygonaceae,Oxyria digyna,7/17/2003,2003,7,17,198,Seep.,,,,,,fruiting,37.7938,-107.3672,3843
Polygonaceae,Oxyria digyna,7/31/2003,2003,7,31,212,Alpine area on rocky outcrops and scree slope.,,,,,,fruiting,37.7904,-107.5577,3841
Polygonaceae,Oxyria digyna,8/3/2003,2003,8,3,215,Alpine meadow ascending to ridge summit with melting snowfield.,,,,,,flowering and fruiting,37.447,-106.6255,3701
Polygonaceae,Oxyria digyna,8/12/2003,2003,8,12,224,Alpine snowfield.,,,,,,flowering and fruiting,37.3528,-106.6873,3351
Polygonaceae,Oxyria digyna,7/5/2003,2003,7,5,186,Subalpine rocky outcrop.,,,,,,fruiting,37.609683,-106.845133,3476
Polygonaceae,Oxyria digyna,7/10/2003,2003,7,10,191,Rocky outcrops in subalpine.,,,,,,flowering and fruiting,37.6097,-106.8453,3498
Polygonaceae,Oxyria digyna,7/13/2003,2003,7,13,194,Subalpine with rocky igneous outcrops.,,,,,,fruiting,37.84,-106.689,3634
Polygonaceae,Oxyria digyna,6/26/2003,2003,6,26,177,Rocky slopes and benches with willow thickets.,,,,,,flowering,37.713583,-107.345833,3913
Polygonaceae,Oxyria digyna,6/24/2004,2004,6,24,176,Alpine meadows.,,,,,,flowering,37.2957,-106.5386,3420
Polygonaceae,Oxyria digyna,7/9/2004,2004,7,9,191,Saddle just below peak.,,,,,,flowering,37.7901,-107.5286,3797
Polygonaceae,Oxyria digyna,7/13/2004,2004,7,13,195,Alpine saddle below peak.,,,,,,flowering and fruiting,37.8356,-107.3471,3837
Polygonaceae,Oxyria digyna,7/17/2004,2004,7,17,199,Alpine meadow to alpine rocky knoll.,,,,,,fruiting,37.7132,-107.5312,3857
Polygonaceae,Oxyria digyna,7/31/2004,2004,7,31,213,Alpine scree and rocky slope into alpine meadow with seeps.,,,,,,flowering and fruiting,37.6258,-107.6192,3897
Polygonaceae,Oxyria digyna,8/16/2004,2004,8,16,229,Subalpine meadow surrounded by spruce forest with seeps.,,,,,,flowering and fruiting,37.1067,-106.5075,3493
Polygonaceae,Oxyria digyna,7/10/2003,2003,7,10,191,Alpine.,,,,,,fruiting,39.9175,-105.6822,3390
Polygonaceae,Oxyria digyna,7/15/2003,2003,7,15,196,Steep eastern alpine slope.,,,,,,fruiting,39.7767,-105.8879,3500
Polygonaceae,Oxyria digyna,7/16/2003,2003,7,16,197,Along trail and streams in alpine and subalpine.,,,,,,fruiting,39.6474,-105.7992,3683
Polygonaceae,Oxyria digyna,7/24/2003,2003,7,24,205,Rocky granite western slope into wet meadow and lakeside.,,,,,,fruiting,40.0761,-105.6354,3329
Polygonaceae,Oxyria digyna,7/28/2003,2003,7,28,209,Steep granite alpine slopes.,,,,,,fruiting,39.6355,-105.8168,3902
Polygonaceae,Oxyria digyna,8/2/2003,2003,8,2,214,"Wet subalpine, lakeside, and rocky coniferous slopes.",,,,,,fruiting,39.6017,-105.7522,3476
Polygonaceae,Oxyria digyna,8/7/2003,2003,8,7,219,Dry alpine slope.,,,,,,flowering and fruiting,39.6208,-105.6053,3720
Polygonaceae,Oxyria digyna,8/10/2003,2003,8,10,222,Alpine.,,,,,,flowering and fruiting,39.8011,-105.7491,3537
Polygonaceae,Oxyria digyna,8/12/2003,2003,8,12,224,Subalpine to alpine.,,,,,,flowering and fruiting,39.8838,-105.7067,3384
Polygonaceae,Oxyria digyna,8/4/2004,2004,8,4,217,Subalpine.,,,,,,fruiting,39.5901,-105.69,3506
Polygonaceae,Oxyria digyna,8/16/2004,2004,8,16,229,Steep rocky alpine slope.,,,,,,fruiting,39.6054,-105.6339,3902
Polygonaceae,Oxyria digyna,8/25/2004,2004,8,25,238,Rocky slope adjacent to lake above treeline.,,,,,,fruiting,40.1337,-105.6733,3293
Polygonaceae,Oxyria digyna,7/3/2004,2004,7,3,185,Steep rocky slope.,,,,,,flowering,39.8299,-105.7409,3488
Polygonaceae,Oxyria digyna,8/11/2004,2004,8,11,224,Alpine meadows and boulder fields; boulder fields.,,,,,,fruiting,40.1466,-105.7162,3415
Polygonaceae,Oxyria digyna,7/15/2001,2001,7,15,196,Exposed alpine turf and scree above treeline to just below summit.,,,,,,flowering and fruiting,39.4694,-106.4877,3659
Polygonaceae,Oxyria digyna,7/28/2001,2001,7,28,209,Open subalpine meadow to spruce krummholz.,,,,,,fruiting,39.0784,-106.6003,3354
Polygonaceae,Oxyria digyna,7/28/2001,2001,7,28,209,"Open alpine meadow, west aspect at lakeside.",,,,,,flowering and fruiting,39.0496,-106.6003,3780
Polygonaceae,Oxyria digyna,8/3/2001,2001,8,3,215,Alpine and subalpine turf-meadow.,,,,,,fruiting,38.92,-106.3036,3902
Polygonaceae,Oxyria digyna,8/5/2001,2001,8,5,217,"Shrubby cinquefoil and krummholz vegetation, west aspect.",,,,,,flowering and fruiting,38.9776,-106.3778,3537
Polygonaceae,Oxyria digyna,8/16/2001,2001,8,16,228,Alpine turf and spruce surrounding small lake.,,,,,,flowering and fruiting,39.3827,-106.5617,3415
Polygonaceae,Oxyria digyna,8/20/2001,2001,8,20,232,Talus slope with some alpine turf.,,,,,,flowering and fruiting,39.3393,-106.1358,3720
Polygonaceae,Oxyria digyna,8/23/2001,2001,8,23,235,Talus slope and alpine meadow.,,,,,,flowering and fruiting,38.6705,-106.251,3537
Polygonaceae,Oxyria digyna,8/8/1989,1989,8,8,220,Alpine tundra.,,,,,,,40.8213,-106.6479,3460
Polygonaceae,Oxyria digyna,8/8/1989,1989,8,8,220,Alpine tundra.,,,,,,,40.8212,-106.6503,3460
Polygonaceae,Oxyria digyna,7/28/1998,1998,7,28,209,Steep north- and east-facing alpine slopes with intermittent open spruce forest at the lower elevation.,,,,,,flowering,37.9217,-107.5131,3476
Polygonaceae,Oxyria digyna,7/31/1998,1998,7,31,212,Alpine meadows into spruce forest.,,,,,,flowering and fruiting,38.0373,-106.9277,3488
Polygonaceae,Oxyria digyna,8/2/1998,1998,8,2,214,Alpine tundra with rocky outcrops.,,,,,,flowering and fruiting,37.965,-107.5863,3805
Polygonaceae,Oxyria digyna,8/9/1998,1998,8,9,221,Spruce forest to alpine tundra with rock outcrops.,,,,,,flowering and fruiting,38.0643,-107.4224,3491
Polygonaceae,Oxyria digyna,8/16/1998,1998,8,16,228,North-facing alpine slope with willows.,,,,,,flowering and fruiting,37.8494,-107.3667,3720
Polygonaceae,Oxyria digyna,8/20/1998,1998,8,20,232,Alpine tundra.,,,,,,flowering and fruiting,37.9361,-107.4216,3841
Polygonaceae,Oxyria digyna,7/30/1999,1999,7,30,211,Alpine tundra.,,,,,,flowering,38.1202,-107.4594,3780
Polygonaceae,Oxyria digyna,8/3/1999,1999,8,3,215,Alpine tundra and rocky slopes.,,,,,,flowering and fruiting,37.9212,-107.4767,3598
Polygonaceae,Oxyria digyna,8/11/1999,1999,8,11,223,Alpine tundra.,,,,,,fruiting,37.9645,-107.0375,3537
Polygonaceae,Oxyria digyna,8/26/1999,1999,8,26,238,Canyon.,,,,,,flowering and fruiting,38.0079,-106.8911,3415
Polygonaceae,Oxyria digyna,7/18/2001,2001,7,18,199,Alpine ridge with Dryas and Salix.,,,,,,flowering and fruiting,40.4915,-105.8509,3354
Polygonaceae,Oxyria digyna,7/26/2001,2001,7,26,207,East facing alpine scree slopes with Geum and Engelmann spruce krummholz.,,,,,,flowering and fruiting,40.6191,-105.9058,3354
Polygonaceae,Oxyria digyna,7/30/2001,2001,7,30,211,Lake shore with Betula and south east facing alpine talus slopes above lake with Geum.,,,,,,flowering and fruiting,40.5466,-105.6595,3476
Polygonaceae,Oxyria digyna,8/1/2001,2001,8,1,213,Flat alpine fellfields and granite boulder piles with Dryas octopetala.,,,,,,flowering and fruiting,40.6188,-105.6676,3415
Polygonaceae,Oxyria digyna,8/3/2001,2001,8,3,215,Subalpine creek crossing with Sibbaldia and Salix and subalpine meadow.,,,,,,flowering and fruiting,40.5939,-105.7232,3232
Polygonaceae,Oxyria digyna,8/5/2001,2001,8,5,217,East facing alpine slopes and ridges with Geum and some granite overhangs.,,,,,,flowering and fruiting,40.5972,-105.9277,3598
Polygonaceae,Oxyria digyna,8/5/2001,2001,8,5,217,East facing alpine slopes and ridges with Geum and granite boulder piles.,,,,,,flowering and fruiting,40.6046,-105.9247,3780
Polygonaceae,Oxyria digyna,8/9/2001,2001,8,9,221,North facing alpine slopes with scree.,,,,,,flowering and fruiting,40.52,-105.8453,3323
Polygonaceae,Oxyria digyna,8/22/2001,2001,8,22,234,"Rocky alpine talus slopes with schist and gneiss, and Engelmann spruce krummholz.",,,,,,flowering and fruiting,40.5589,-105.6271,3354
Polygonaceae,Oxyria digyna,7/5/2000,2000,7,5,187,Alpine fell field with small turfy areas.,,,,,,flowering and fruiting,40.5465,-105.9039,3354
Polygonaceae,Oxyria digyna,7/19/2000,2000,7,19,201,Alpine slopes and ridges of volcanic mountain.,,,,,,flowering and fruiting,40.3582,-105.9608,3415
Polygonaceae,Oxyria digyna,7/19/2000,2000,7,19,201,Alpine ridge.,,,,,,flowering and fruiting,40.3727,-105.9608,3476
Polygonaceae,Oxyria digyna,7/21/2000,2000,7,21,203,Rocky slope to summit of peak.,,,,,,flowering and fruiting,40.6044,-105.9229,3872
Polygonaceae,Oxyria digyna,7/23/2000,2000,7,23,205,Spruce-fir forest and rocky slopes.,,,,,,flowering,40.7947,-107.3845,3293
Polygonaceae,Oxyria digyna,7/30/2000,2000,7,30,212,Rocky south exposure and ridge.,,,,,,flowering and fruiting,40.3251,-106.1282,3232
Polygonaceae,Oxyria digyna,7/30/2000,2000,7,30,212,Rocky north exposure.,,,,,,flowering and fruiting,40.3251,-106.1282,3598
Polygonaceae,Oxyria digyna,7/31/2000,2000,7,31,213,Lake shore and slopes.,,,,,,flowering and fruiting,40.4741,-105.9039,3251
Polygonaceae,Oxyria digyna,8/8/2000,2000,8,8,221,Rocky slopes.,,,,,,flowering and fruiting,40.561,-105.9229,3354
Polygonaceae,Oxyria digyna,8/8/2000,2000,8,8,221,Alpine rocky slope.,,,,,,fruiting,40.5755,-105.9229,3506
Polygonaceae,Oxyria digyna,8/15/2000,2000,8,15,228,Rocky near-alpine summit and wet areas around melting snowbank.,,,,,,fruiting,40.9228,-106.6884,3293
Polygonaceae,Oxyria digyna,7/10/2001,2001,7,10,191,Alpine.,,,,,,fruiting,40.402472,-105.916444,3476
Polygonaceae,Oxyria digyna,6/30/2001,2001,6,30,181,"Dry, alpine, scree slopes with Geum and Erigeron.",,,,,,flowering,40.5538,-105.9094,3354
Polygonaceae,Oxyria digyna,7/27/2001,2001,7,27,208,South facing alpine ridges and slopes around and above the lakes with Geum and Sibbaldia.,,,,,,flowering and fruiting,40.4768,-105.8796,3415
Polygonaceae,Oxyria digyna,8/14/2001,2001,8,14,226,"Steep, east facing alpine talus slopes of granite and krummholz.",,,,,,flowering and fruiting,40.4887,-105.8868,3506
Polygonaceae,Oxyria digyna,7/12/1984,1984,7,12,194,Common on moist sites on gentle N-facing slopes near ridgetop.,,,,,,flowering,38.6925,-106.47392,3752
Polygonaceae,Oxyria digyna,9/13/1922,1922,9,13,256,"On steep east-facing slope in rocky loam soil with Aletes, Cinquefoil and Sedges.",,,,,,flowering,37.43876,-108.07632,3963
Polygonaceae,Oxyria digyna,1920-07-00,1920,7,0,,"In dry, gravel soil of grassland.",,,,,,flowering,38.91093,-106.36572,3965
Polygonaceae,Oxyria digyna,8/20/1985,1985,8,20,232,Common in moist granitic gravelly soil in tundra of steep N-facing slope.,,,,,,flowering,37.28864,-106.57092,4002
Polygonaceae,Oxyria digyna,8/15/1998,1998,8,15,227,"Steep, gravelly slope of alpine peak, N-facing crevice of rock. Circumboreal distribution. Growing with Ligularia taraxacoides, Eriogonum sp., Oligosporus groenlandica, Ipomopsis globularis, and Tonestus pygmaeus.",,,,,,flowering,39.10551,-106.17829,3693
Polygonaceae,Oxyria digyna,8/15/1986,1986,8,15,227,Moist soil and crevices in rocks.,,,,,,flowering,40.3774,-105.6763,3537
Polygonaceae,Oxyria digyna,8/17/1978,1978,8,17,229,Grassy meadow and rocky flats.,,,,,,flowering,39.10502,-106.45533,4074
Polygonaceae,Oxyria digyna,7/11/1989,1989,7,11,192,Talus and boulder field; mostly acidic schist.,,,,,,flowering,38.80866,-106.42253,3894
Polygonaceae,Oxyria digyna,7/15/1998,1998,7,15,196,Mesic alpine meadows NE of lake with Acomastylis rossii and Deschampsia cespitosa.,,,,,,flowering,37.58854,-105.50724,3659
Polygonaceae,Oxyria digyna,7/12/1998,1998,7,12,193,Alpine.,,,,,,flowering and fruiting,38.0916,-105.6451,3659
Polygonaceae,Oxyria digyna,7/16/1998,1998,7,16,197,Picea engelmannii/Pinus aristata and alpine on south-facing slope.,,,,,,flowering and fruiting,38.4036,-106.241,3476
Polygonaceae,Oxyria digyna,7/31/1998,1998,7,31,212,Areas with Picea and alpine around lakes,,,,,,flowering and fruiting,38.3484,-105.87,3354
Polygonaceae,Oxyria digyna,8/7/1998,1998,8,7,219,Alpine.,,,,,,flowering and fruiting,37.9622,-105.5115,3354
Polygonaceae,Oxyria digyna,8/17/1998,1998,8,17,229,Alpine.,,,,,,flowering and fruiting,37.9767,-105.5481,3841
Polygonaceae,Oxyria digyna,8/14/1998,1998,8,14,226,Steep talus slopes with pockets of vegetation; plant species diversity very low.,,,,,,flowering and fruiting,37.3747,-104.9653,3354
Polygonaceae,Oxyria digyna,7/13/2010,2010,7,13,194,Upper subalpine-alpine rocky meadow.,,,,,,flowering,39.467,-105.9936,3366
Polygonaceae,Oxyria digyna,7/17/2010,2010,7,17,198,"Rocky alpine meadow, snowmelt basins and ponds.",,,,,,flowering and fruiting,39.0521,-106.7475,3591
Polygonaceae,Oxyria digyna,7/19/2010,2010,7,19,200,"Alpine meadows, barrens, and snowdrifts.",,,,,,flowering and fruiting,39.4932,-106.2533,3598
Polygonaceae,Oxyria digyna,7/21/2010,2010,7,21,202,Alpine meadows and fellfields.,,,,,,flowering and fruiting,39.5349,-105.8323,3598
Polygonaceae,Oxyria digyna,7/23/2010,2010,7,23,204,Alpine meadows and boulder fields.,,,,,,fruiting,39.6187,-106.1397,3659
Polygonaceae,Oxyria digyna,7/25/2010,2010,7,25,206,Riparian corridor and wet meadow terraces adjacent to waterfall.,,,,,,flowering,39.3855,-106.0966,3476
Polygonaceae,Oxyria digyna,7/26/2010,2010,7,26,207,Alpine meadow and talus slope.,,,,,,flowering and fruiting,39.4233,-106.1089,3683
Polygonaceae,Oxyria digyna,7/31/2010,2010,7,31,212,Alpine talus slopes and rocky meadows.,,,,,,fruiting,39.4627,-105.9364,3532
Polygonaceae,Oxyria digyna,8/5/2010,2010,8,5,217,Rocky alpine meadows and talus slopes.,,,,,,fruiting,39.4059,-105.9822,3515
Polygonaceae,Oxyria digyna,8/7/2010,2010,8,7,219,Alpine meadows and talus slopes.,,,,,,flowering and fruiting,39.5118,-106.1111,3457
Polygonaceae,Oxyria digyna,8/9/2010,2010,8,9,221,Upper subalpine and alpine meadow and talus slope.,,,,,,fruiting,39.4903,-106.4544,3415
Polygonaceae,Oxyria digyna,8/17/1999,1999,8,17,229,Alpine.,,,,,,flowering and fruiting,37.5944,-105.4625,3659
Polygonaceae,Oxyria digyna,8/11/2010,2010,8,11,223,"Alpine meadow, riparian, and talus.",,,,,,fruiting,39.6339,-105.8176,3683
Polygonaceae,Oxyria digyna,8/17/1999,1999,8,17,229,Alpine.,,,,,,flowering and fruiting,37.5833,-105.4667,3902
Polygonaceae,Oxyria digyna,7/16/1999,1999,7,16,197,Alpine.,,,,,,flowering,37.933,-105.5298,3835
Polygonaceae,Oxyria digyna,7/22/1999,1999,7,22,203,Alpine.,,,,,,flowering,38.0479,-105.6086,3659
Polygonaceae,Oxyria digyna,8/23/2011,2011,8,23,235,Boulder field.,,,,,,fruiting,39.8398,-106.4223,3341
Polygonaceae,Oxyria digyna,8/16/2011,2011,8,16,228,Rocky alpine ridge and slopes.,,,,,,fruiting,39.1047,-107.1125,3622
Polygonaceae,Oxyria digyna,8/18/2011,2011,8,18,230,Rock outcrop in alpine.,,,,,,fruiting,39.0387,-107.0086,3579
Polygonaceae,Oxyria digyna,8/19/2011,2011,8,19,231,Alpine meadow.,,,,,,fruiting,39.0483,-107.0372,3396
Polygonaceae,Oxyria digyna,7/25/1999,1999,7,25,206,Southwestern alpine slope.,,,,,,flowering,37.6093,-105.5131,3750
Polygonaceae,Oxyria digyna,7/25/1999,1999,7,25,206,Northwestern alpine slope.,,,,,,flowering and fruiting,37.6093,-105.5131,3902
Polygonaceae,Oxyria digyna,7/23/2011,2011,7,23,204,"Alpine talus slopes, clearings, and rock crevices in limestone and granite.",,,,,,flowering,39.5219,-106.6305,3659
Polygonaceae,Oxyria digyna,7/25/2011,2011,7,25,206,"Alpine meadows, rocky slopes, and talus fields.",,,,,,flowering and fruiting,39.543,-106.1892,3598
Polygonaceae,Oxyria digyna,7/26/1999,1999,7,26,207,Alpine,,,,,,flowering and fruiting,37.9861,-105.6467,3841
Polygonaceae,Oxyria digyna,8/1/2011,2011,8,1,213,"Alpine meadows, talus slopes, and rock crevices.",,,,,,flowering and fruiting,39.657,-105.8834,3655
Polygonaceae,Oxyria digyna,8/5/2011,2011,8,5,217,"Snowmelt basin with alpine meadows, talus slopes, and rock crevices.",,,,,,fruiting,39.0185,-106.8553,3720
Polygonaceae,Oxyria digyna,8/7/2011,2011,8,7,219,"Alpine talus slopes, meadows, and rock crevices.",,,,,,flowering and fruiting,39.0448,-106.5982,3780
Polygonaceae,Oxyria digyna,8/9/2011,2011,8,9,221,North-facing talus fields and upper subalpine meadows.,,,,,,flowering and fruiting,39.187,-107.0731,3415
Polygonaceae,Oxyria digyna,8/11/2011,2011,8,11,223,"Alpine talus slope, meadow, and rock crevices.",,,,,,fruiting,39.108,-107.0684,3415
Polygonaceae,Oxyria digyna,7/26/1999,1999,7,26,207,Alpine,,,,,,flowering and fruiting,37.988,-105.6444,4207
Polygonaceae,Oxyria digyna,8/12/2011,2011,8,12,224,"Alpine meadow, talus slope, and rock crevices.",,,,,,flowering and fruiting,39.1135,-107.1468,3659
Polygonaceae,Oxyria digyna,8/14/2011,2011,8,14,226,"Alpine meadows, rock crevices and talus slopes.",,,,,,flowering and fruiting,39.2427,-106.4974,3634
Polygonaceae,Oxyria digyna,8/17/2011,2011,8,17,229,Rocky slopes on either side of roadbed and old railroad grade.,,,,,,flowering and fruiting,39.2645,-106.5144,3430
Polygonaceae,Oxyria digyna,8/16/2011,2011,8,16,228,Rocky alpine ridge and slopes.,,,,,,fruiting,39.1047,-107.1125,3622
Polygonaceae,Oxyria digyna,7/28/1990,1990,7,28,209,Rocky basalt lake basin.,,,,,,,39.9206,-107.174,3415
Polygonaceae,Oxyria digyna,8/8/2001,2001,8,8,220,Rolling tundra with tree islands of Picea with many ponds. Rocky slopes.,,,,,,,37.24611,-106.65083,3509
Polygonaceae,Oxyria digyna,8/9/2002,2002,8,9,221,"alpine tundra, limestone slope.",,,,,,,38.768611,-106.3975,3660
Polygonaceae,Oxyria digyna,7/31/2014,2014,7,31,212,"Wet ledges and seeps at base of cliff band. Growing from rocks, cracks and ledges.",,"Common, in bloom.",,,,Flowers,39.02108,-107.08633,3540
Polygonaceae,Oxyria digyna,9/3/2014,2014,9,3,246,Much loose scree. Some willow stands lower on slope. At base of large boulders and ledges.,,Common. In fruit.,,,,Fruits,39.004181,-106.974836,3719
Polygonaceae,Oxyria digyna,8/7/2010,2010,8,7,219,NNW facing slopes of high alpine basin. Very moist with several ephemeral streambeds. Along streams.,,Fruits with 2 valves (Rumex have 3). Leaves Kidney-shaped.  Full bloom.  Very common.,,,,,38.96634,-106.93224,3662
Polygonaceae,Oxyria digyna,7/31/2011,2011,7,31,212,"Thin, red clay soils; often among rocks along narrow ridgeline. Growing in sheltered sites under rock ledges. Overall fairly dry sites.",,Full bloom. Uncommon.,,,,Full bloom.,39.04459,-106.99821,4033
Polygonaceae,Oxyria digyna,8/7/2011,2011,8,7,219,"Very rocky, with few spots with very shallow soil. Most plant growing from cracks in rock. Growing from cracks and beneath overhangs all along rocky crest of ridge.",,Full bloom. Farily common,,,,Full bloom.,38.980196,-106.92646,4127
Polygonaceae,Oxyria digyna,6/29/2012,2012,6,29,181,"Near bottom of S facing almost barren talus slope on S side of lake above outlet in fine soil and gravel cemented by lichens and mosses; only close associates include Lidia obtusiloba, Draba crassifolia, Primula parryi, Carex perglobosa, Acomastylis rossii, Festuca sp.; rooted under N side of large boulder; locally common.",,,,,,,39.596,-105.64119,3920
Polygonaceae,Oxyria digyna,8/5/2014,2014,8,5,217,Growing in talus above upper subalpine meadow bounded by spruce forest.,,,,,,Fruit,38.18387,-107.42326,3370
Polygonaceae,Oxyria digyna,8/6/2014,2014,8,6,218,Alpine talus field in W-facing cirque below Baldy Cinco mountain. Immediately above willow thicket.,,Locally uncommon.,,,,Flower and fruit,37.94451,-107.12588,3644
POLYGONACEAE,Oxyria digyna,7/26/1970,1970,7,26,207,,,,,,,,39.596731,-105.640845,3658
POLYGONACEAE,Oxyria digyna,8/22/1973,1973,8,22,234,In sand among rocks on E facing slope,,,,,,,39.649682,-105.777122,3871
POLYGONACEAE,Oxyria digyna,8/9/1980,1980,8,9,222,In rocks on talus slide just below tree line.,,,,,,,40.058503,-105.580604,3231
POLYGONACEAE,Oxyria digyna,8/26/1961,1961,8,26,238,,,,,,,,39.586631,-105.642359,4267
POLYGONACEAE,Oxyria digyna,7/19/1931,1931,7,19,200,Among rocks,,,,,,,38.838555,-105.043186,3810
POLYGONACEAE,Oxyria digyna,7/16/1947,1947,7,16,197,,,,,,,,39.36035,-106.060988,3292
POLYGONACEAE,Oxyria digyna,7/5/1948,1948,7,5,187,,,,,,,,38.998471,-106.940469,3780
POLYGONACEAE,Oxyria digyna,8/5/1961,1961,8,5,217,"Above timberline; in moist soil, well under the overhang of a large boulder.",,Perianth red-green.,,,,,39.636196,-105.596938,3658
POLYGONACEAE,Oxyria digyna,7/17/1999,1999,7,17,198,Side of the road in Alpine Tundra; infrequent.,,,,,,,39.62527,-105.78194,3993
POLYGONACEAE,Oxyria digyna,8/15/1989,1989,8,15,227,"E-facing, alpine talus slope",,Circumarboreal distribution.,,,,,39.122265,-106.191167,3688
POLYGONACEAE,Oxyria digyna,7/9/1998,1998,7,9,190,Alpine tundra to summit of mountain,,,,,,,38.933519,-106.711672,3536
POLYGONACEAE,Oxyria digyna,9/9/1995,1995,9,9,252,"rocky hillside, near stream;  below timberline; open area",,collection note - N39 40'   W105 45,,,,,39.598114,-106.01668,3444
POLYGONACEAE,Oxyria digyna,7/16/1984,1984,7,16,198,"under rock overhang; blockfield, south-facing slope",,,,,,,38.826426,-106.407376,3795
POLYGONACEAE,Oxyria digyna,7/21/1981,1981,7,21,202,wet meadow in lower part of basin,,,,,,,37.915968,-107.515688,3731
POLYGONACEAE,Oxyria digyna,8/1/1981,1981,8,1,213,Talus slpoe,,,,,,,37.974381,-107.762699,3536
POLYGONACEAE,Oxyria digyna,8/1/1981,1981,8,1,213,Talus slope,,,,,,,37.974381,-107.762699,3505
POLYGONACEAE,Oxyria digyna,7/7/1981,1981,7,7,188,rocky roadside,,,,,,,39.021474,-107.085109,3627
POLYGONACEAE,Oxyria digyna,7/21/1968,1968,7,21,203,NE-facing slope in the alpine-subalpine ecotone.  Study area included on alpine knob with exposed boulders; gentle to moderate slope leading down to Sneffels Creek; mid-slope; steep rocky exposed.,,,,,,,37.987639,-107.784702,3731
POLYGONACEAE,Oxyria digyna,7/21/1968,1968,7,21,203,NE-facing slop in the alpine-subalpine ecotone.  Study area included on alpine knob with exposed boulders; gentle to moderate slopes leading down to Sneffels Creek; around rocks adjacent to creek.,,,,,,,37.987639,-107.784702,3731
POLYGONACEAE,Oxyria digyna,6/21/2006,2006,6,21,172,Alpine tundra among cliffs and talus. Hard Rock.,,,,,,,38.304536,-105.86661,3658
POLYGONACEAE,Oxyria digyna,7/8/2007,2007,7,8,189,"Steep, unstable talus just below summit",,,,,,,37.78662,-107.524328,3962
POLYGONACEAE,Oxyria digyna,8/17/2009,2009,8,17,229,"Above timberline in rock crevices of moist drainage; associates include Mertensia ciliata, Veronica nutans, Stellaria umbellata, Epilobium anagallidifolium, Packera dimorphophylla. Granitic substrate.",,Tepals pinkish; occasional.,,,,,38.816751,-105.031585,3621
POLYGONACEAE,Oxyria digyna,7/16/2009,2009,7,16,197,"Dense alpine turf community on boulder strewn slope; dominants include Carex rupestris ssp. drummondiana, Kobresia myosuroides, Acomastylis rossii ssp. turbinata; associates include Mertensia alpina, Dryas ocatapetala, Poa arctica, Carex chalciolepis, against overhanging boulder in deep shade. Granitic substrate.",,"Flowers tiny, pinkish; rare locally.",,,,,38.827078,-105.027764,3804
Pyrolaceae,Moneses uniflora,7/26/2003,2003,7,26,207,,,,,,,,37.71602,-107.56307,3292
Pyrolaceae,Moneses uniflora,1896-07-07,1896,7,7,189,swamp,,,,,,,40.5797,-105.5974,3276
Pyrolaceae,Moneses uniflora,1892-08-01,1892,8,1,214,,,,,,,,40.5777,-105.5974,3352
Pyrolaceae,Moneses uniflora,8/6/1945,1945,8,6,218,shade,,,,,,,37.1844,-106.5833,3352
Pyrolaceae,Moneses uniflora,8/19/1986,1986,8,19,231,shade of NE exposure,,,,,,,37.127,-106.4751,3500
Pyrolaceae,Moneses uniflora,8/19/1974,1974,8,19,231,,,,,,,,39.9064,-105.8787,3297
Pyrolaceae,Moneses uniflora,8/14/1944,1944,8,14,227,moist loam soil,,,,,,,38.2232,-106.2781,3505
Pyrolaceae,Moneses uniflora,9/3/1985,1985,9,3,246,"dense shade, duff",,,,,,,37.5691,-106.7937,3341
Pyrolaceae,Moneses uniflora,8/3/1984,1984,8,3,216,loam of gentle NNW exposure,,,,,,,37.5691,-106.5775,3438
Pyrolaceae,Moneses uniflora,8/19/1971,1971,8,19,231,silt loam of W exposure,,,,,,,38.3281,-106.1981,3535
Pyrolaceae,Moneses uniflora,8/11/1942,1942,8,11,223,sandy N slope,,,,,,,38.1403,-105.703,3505
Pyrolaceae,Moneses uniflora,7/27/1972,1972,7,27,209,sandy-rocky soil,,,,,,,39.4694,-105.932,3200
Pyrolaceae,Moneses uniflora,8/10/1998,1998,8,10,222,Subalpine logged area.,,,,,,,37.2881,-106.7457,3353
Pyrolaceae,Moneses uniflora,7/29/2004,2004,7,29,211,,,,,,,,37.533235,-107.596498,3505
Pyrolaceae,Moneses uniflora,8/7/2010,2010,8,7,219,"Steep NW facing slopes through Engelmann Spruce-Subalpine Fir forest.  In shady, mossy seeps in spruce duff.",,"A single large, white flower per stalk, from a basal rosette of obovate leaves.  Full bloom.  Very Common.",,,,,38.97435,-106.94868,3261
PYROLACEAE,Moneses uniflora,8/11/1995,1995,8,11,223,"Lower Mississipian & Ordvician calcareous rocks including limestone, sandstone & dolomite. In duff of Picea engelmannii forest; scattered locally.",,"Flowers nodding, white",,,,,39.012041,-106.111134,3353
Ranunculaceae,Aquilegia caerulea,7/20/2010,2010,7,20,201,"Lake side, Englemann spruce forest",,,,,,,37.885667,-107.844833,3430
Ranunculaceae,Aquilegia coerulea var. coerulea,7/2/1959,1959,7,2,183,boulders,,,,,,,40.1514,-105.5309,3352
Ranunculaceae,Aquilegia coerulea var. coerulea,1892-07-16,1892,7,16,198,,,,,,,,39.6876,-105.797,3596
Ranunculaceae,Aquilegia coerulea var. coerulea,7/20/1985,1985,7,20,201,"moist soil, W expos",,,,,,,37.2658,-106.6509,3413
Ranunculaceae,Aquilegia coerulea var. coerulea,8/2/1945,1945,8,2,214,,,,,,,,37.3162,-106.5837,3505
Ranunculaceae,Aquilegia coerulea var. coerulea,7/11/1971,1971,7,11,192,"steep fellfield, rocky shallow peat soil",,,,,,,40.073,-105.5953,3901
Ranunculaceae,Aquilegia coerulea var. coerulea,7/4/1961,1961,7,4,185,rocky hillside,,,,,,,38.6859,-106.43829,3352
Ranunculaceae,Aquilegia coerulea var. coerulea,7/19/1981,1981,7,19,200,moist meadow,,,,,,,38.0638,-107.4511,3517
Ranunculaceae,Aquilegia coerulea var. coerulea,1896-07-08,1896,7,8,190,,,,,,,,40.5803,-105.5803,3276
Ranunculaceae,Aquilegia coerulea var. coerulea,1896-07-06,1896,7,6,188,,,,,,,,40.5797,-105.5974,3276
Ranunculaceae,Aquilegia coerulea var. coerulea,1986-07-00,1986,7,0,,,,,,,,,39.0203,-106.7556,3850
Ranunculaceae,Aquilegia coerulea var. coerulea,7/1/1984,1984,7,1,183,"silty loam of gentle N expos, meadow",,,,,,,37.5103,-106.448,3547
Ranunculaceae,Aquilegia coerulea var. coerulea,7/14/1971,1971,7,14,195,"rocky silty soil, S expos",,,,,,,38.351,-106.2697,3566
Ranunculaceae,Aquilegia coerulea var. coerulea,8/17/1979,1979,8,17,229,"sandy clay soil, salus slopes",,,,,,,37.82672,-107.79469,3780
Ranunculaceae,Aquilegia coerulea var. coerulea,8/1/1972,1972,8,1,214,"sandy-gravelly soil, NE expos",,,,,,,39.4116,-105.9876,3657
Ranunculaceae,Aquilegia coerulea var. coerulea,7/18/1972,1972,7,18,200,sandy S expos,,,,,,,39.3827,-106.0987,3474
Ranunculaceae,Aquilegia coerulea var. coerulea,7/13/1994,1994,7,13,194,W-facing slope.  Subalpine riparian meadow.,,,,,,,37.7199,-107.8989,3383
Ranunculaceae,Aquilegia coerulea var. coerulea,6/26/1994,1994,6,26,177,"Common, erect herb on rocky soil on an alpine ridge of moderate W slope.",,,,,,,40.3106,-106.2237,3300
Ranunculaceae,Aquilegia coerulea var. coerulea,7/26/1998,1998,7,26,207,Upper drainage in flats.  Alpine tundra.  Talus.,,,,,,,37.3878,-106.6819,3651
Ranunculaceae,Aquilegia coerulea var. coerulea,8/7/1995,1995,8,7,219,"Uncommon, erect herb on gravelly soil of steep E slope with alpine.",,,,,,,40.3251,-106.1301,3500
Ranunculaceae,Aquilegia coerulea var. coerulea,7/26/1995,1995,7,26,207,Roadside.  Rocky soils.,,,,,,,37.8061,-107.568,3292
Ranunculaceae,Aquilegia coerulea var. coerulea,8/15/1993,1993,8,15,227,"Rare, erect herb on gravelly soil in alpine tundra of moderate N slope.",,,,,,,40.3396,-106.1301,3444
Ranunculaceae,Aquilegia coerulea var. coerulea,7/6/2002,2002,7,6,187,Growing on rocky slope.,,,,,,,40.595278,-105.943056,3292
Ranunculaceae,Aquilegia coerulea var. coerulea,7/19/2003,2003,7,19,200,"Meadow, rocky soil.",,,,,,,39.8294,-105.6305,3292
Ranunculaceae,Aquilegia coerulea var. coerulea,7/15/1993,1993,7,15,196,"Uncommon, erect herb.",,,,,,,40.3396,-106.1301,3414
Ranunculaceae,Aquilegia coerulea,7/16/2004,2004,7,16,198,Alpine tundra.,,,,,,,40.47395,-105.90278,3481
Ranunculaceae,Aquilegia coerulea var. coerulea,7/24/2003,2003,7,24,205,Rocky granite western slope into wet meadow and lakeside.,,,,,,,40.0761,-105.6354,3328
Ranunculaceae,Aquilegia coerulea var. coerulea,7/8/2003,2003,7,8,189,Fellfield in meadow.,,,,,,flowering,37.5637,-106.5534,3390
Ranunculaceae,Aquilegia coerulea var. coerulea,7/13/2003,2003,7,13,194,Fellfields and turfy areas.,,,,,,flowering,37.6886,-107.1188,3585
Ranunculaceae,Aquilegia coerulea var. coerulea,7/26/2003,2003,7,26,207,Along creek in open meadow with scattered spruce and bristle cone pine.,,,,,,flowering and fruiting,37.7765,-106.6597,3293
Ranunculaceae,Aquilegia coerulea var. coerulea,7/28/2003,2003,7,28,209,Rocky outcrops in bristle cone and spruce forest.,,,,,,flowering and fruiting,37.4921,-106.671,3468
Ranunculaceae,Aquilegia coerulea var. coerulea,8/1/2003,2003,8,1,213,Rocky outcrops to alpine summit.,,,,,,flowering,37.7643,-107.5642,3622
Ranunculaceae,Aquilegia coerulea var. coerulea,7/5/2003,2003,7,5,186,Subalpine rocky outcrop.,,,,,,flowering,37.609683,-106.845133,3476
Ranunculaceae,Aquilegia coerulea var. coerulea,7/13/2003,2003,7,13,194,Seasonal drainage.,,,,,,flowering,37.7893,-106.7404,3216
Ranunculaceae,Aquilegia coerulea var. coerulea,7/13/2003,2003,7,13,194,Subalpine with rocky igneous outcrops.,,,,,,flowering,37.84,-106.689,3634
Ranunculaceae,Aquilegia coerulea var. coerulea,7/5/2004,2004,7,5,187,Subalpine south southwest-facing slope with some rocky outcrops.,,,,,,flowering,37.4602,-106.4146,3419
Ranunculaceae,Aquilegia coerulea var. coerulea,7/11/2004,2004,7,11,193,Rocky southwest-facing slope into subalpine.,,,,,,flowering,37.9013,-106.7846,3782
Ranunculaceae,Aquilegia coerulea var. coerulea,7/17/2004,2004,7,17,199,Alpine lake up a southwest-facing 35 deg slope.,,,,,,flowering,37.7114,-107.528,3701
Ranunculaceae,Aquilegia coerulea var. coerulea,7/25/2004,2004,7,25,207,Boulder field on north-facing slope.,,,,,,flowering and fruiting,37.6806,-106.911,3278
Ranunculaceae,Aquilegia coerulea var. coerulea,7/29/2004,2004,7,29,211,"Old clear cut spruce forest with scattered aspen, bristlecone and limber pine on north-facing slope.",,,,,,flowering,37.9961,-106.4701,3338
Ranunculaceae,Aquilegia coerulea var. coerulea,7/9/2004,2004,7,9,191,Rocky slopes.,,,,,,flowering,37.7311,-107.5086,3659
Ranunculaceae,Aquilegia coerulea var. coerulea,7/9/2004,2004,7,9,191,Rocky slopes.,,,,,,flowering,37.7311,-107.5086,3659
Ranunculaceae,Aquilegia coerulea var. coerulea,7/9/2003,2003,7,9,190,Subalpine and alpine steep slopes.,,,,,,flowering,40.3284,-106.1315,3561
Ranunculaceae,Aquilegia coerulea var. coerulea,7/16/2003,2003,7,16,197,Along trail and streams in alpine and subalpine.,,,,,,flowering,39.6474,-105.7992,3683
Ranunculaceae,Aquilegia coerulea var. coerulea,7/19/2003,2003,7,19,200,Along stream and wet meadows in subalpine.,,,,,,flowering,40.0186,-105.6936,3207
Ranunculaceae,Aquilegia coerulea var. coerulea,7/24/2003,2003,7,24,205,Rocky granite western slope into wet meadow and lakeside.,,,,,,flowering,40.0761,-105.6354,3329
Ranunculaceae,Aquilegia coerulea var. coerulea,8/2/2003,2003,8,2,214,"Wet subalpine, lakeside, and rocky coniferous slopes.",,,,,,flowering,39.6017,-105.7522,3476
Ranunculaceae,Aquilegia coerulea var. coerulea,8/5/2004,2004,8,5,218,Wet meadow adjacent to stream and spruce stands.,,,,,,flowering,39.675,-105.9072,3476
Ranunculaceae,Aquilegia coerulea var. coerulea,8/11/2004,2004,8,11,224,Alpine meadows and boulder fields; boulder fields.,,,,,,fruiting,40.1466,-105.7162,3415
Ranunculaceae,Aquilegia coerulea var. coerulea,8/11/2004,2004,8,11,224,Alpine meadows and boulder fields; boulder fields.,,,,,,flowering,40.1466,-105.7162,3415
Ranunculaceae,Aquilegia coerulea var. coerulea,7/19/2001,2001,7,19,200,Spruce forest around a palustrine wetland (small lake).,,,,,,flowering and fruiting,39.296,-106.4136,3415
Ranunculaceae,Aquilegia coerulea var. coerulea,7/25/2001,2001,7,25,206,Willow carr surrounded by lodgepole and spruce.,,,,,,flowering and fruiting,39.0208,-106.5632,3415
Ranunculaceae,Aquilegia coerulea var. coerulea,7/28/2001,2001,7,28,209,Open subalpine meadow to spruce krummholz.,,,,,,flowering and fruiting,39.0784,-106.6003,3354
Ranunculaceae,Aquilegia coerulea var. coerulea,8/5/2001,2001,8,5,217,"Shrubby cinquefoil and krummholz vegetation, west aspect.",,,,,,flowering and fruiting,38.9776,-106.3778,3537
Ranunculaceae,Aquilegia coerulea var. coerulea,8/16/2001,2001,8,16,228,Alpine turf and spruce surrounding small lake.,,,,,,flowering and fruiting,39.3827,-106.5617,3415
Ranunculaceae,Aquilegia coerulea var. coerulea,7/14/1998,1998,7,14,195,Open spruce forest.,,,,,,flowering,37.9939,-107.2021,3488
Ranunculaceae,Aquilegia coerulea var. coerulea,7/14/1998,1998,7,14,195,Open spruce forest.,,,,,,flowering,37.9361,-107.1655,3317
Ranunculaceae,Aquilegia coerulea var. coerulea,7/28/1998,1998,7,28,209,Steep north- and east-facing alpine slopes with intermittent open spruce forest at the lower elevation.,,,,,,flowering,37.9217,-107.5131,3476
Ranunculaceae,Aquilegia coerulea var. coerulea,7/31/1998,1998,7,31,212,Alpine meadows into spruce forest.,,,,,,flowering,38.0373,-106.9277,3488
Ranunculaceae,Aquilegia coerulea var. coerulea,8/2/1998,1998,8,2,214,Alpine tundra with rocky outcrops.,,,,,,flowering,37.965,-107.5863,3805
Ranunculaceae,Aquilegia coerulea var. coerulea,8/5/1998,1998,8,5,217,Spruce forest to alpine plateau.,,,,,,flowering,38.0951,-107.1472,3293
Ranunculaceae,Aquilegia coerulea var. coerulea,8/9/1998,1998,8,9,221,Spruce forest to alpine tundra with rock outcrops.,,,,,,fruiting,38.0643,-107.4224,3491
Ranunculaceae,Aquilegia coerulea var. coerulea,8/11/1998,1998,8,11,223,Mixed conifer/aspen forest to alpine.,,,,,,flowering,38.2438,-106.8815,3329
Ranunculaceae,Aquilegia coerulea var. coerulea,8/16/1998,1998,8,16,228,North-facing alpine slope with willows.,,,,,,flowering,37.8494,-107.3667,3720
Ranunculaceae,Aquilegia coerulea var. coerulea,8/19/1998,1998,8,19,231,Spruce forest and riparian.,,,,,,flowering,38.1942,-107.4219,3256
Ranunculaceae,Aquilegia coerulea var. coerulea,8/20/1998,1998,8,20,232,Alpine tundra.,,,,,,fruiting,37.9361,-107.4216,3598
Ranunculaceae,Aquilegia coerulea var. coerulea,7/29/1999,1999,7,29,210,Alpine tundra.,,,,,,flowering,38.1494,-107.4594,3780
Ranunculaceae,Aquilegia coerulea var. coerulea,8/11/1999,1999,8,11,223,Spruce forest to montane.,,,,,,flowering,37.9645,-107.0375,3280
Ranunculaceae,Aquilegia coerulea var. coerulea,8/26/1999,1999,8,26,238,Upper portion of canyon to lower portion of basin.,,,,,,flowering,38.0079,-106.8911,3549
Ranunculaceae,Aquilegia coerulea var. coerulea,7/15/2001,2001,7,15,196,"Steep, east facing subalpine slopes with spruce-fir forest and creek.",,,,,,flowering,40.5175,-105.9017,3201
Ranunculaceae,Aquilegia coerulea var. coerulea,7/18/2001,2001,7,18,199,East facing subalpine slopes with Engelmann spruce.,,,,,,flowering,40.4915,-105.8509,3354
Ranunculaceae,Aquilegia coerulea var. coerulea,7/20/2001,2001,7,20,201,Subalpine spruce-fir slopes transitioning into east facing Krummholz slopes.,,,,,,flowering,40.6802,-105.9489,3262
Ranunculaceae,Aquilegia coerulea var. coerulea,7/22/2001,2001,7,22,203,"Dry, open, east facing alpine slopes.",,,,,,flowering,40.7255,-105.9906,3354
Ranunculaceae,Aquilegia coerulea var. coerulea,8/1/2001,2001,8,1,213,Flat alpine fellfields and granite boulder piles with Dryas octopetala.,,,,,,flowering and fruiting,40.6188,-105.6676,3415
Ranunculaceae,Aquilegia coerulea var. coerulea,8/3/2001,2001,8,3,215,North facing alpine slopes and flat topped summit with Geum.,,,,,,fruiting,40.5793,-105.7253,3415
Ranunculaceae,Aquilegia coerulea var. coerulea,8/5/2001,2001,8,5,217,East facing alpine slopes and ridges with Geum and granite boulder piles.,,,,,,flowering and fruiting,40.6046,-105.9247,3780
Ranunculaceae,Aquilegia coerulea var. coerulea,7/5/2000,2000,7,5,187,Alpine fell field with small turfy areas.,,,,,,flowering,40.5465,-105.9039,3354
Ranunculaceae,Aquilegia coerulea var. coerulea,7/19/2000,2000,7,19,201,Alpine ridge.,,,,,,flowering,40.3727,-105.9608,3476
Ranunculaceae,Aquilegia coerulea var. coerulea,7/31/2000,2000,7,31,213,Lake shore and slopes.,,,,,,flowering,40.4741,-105.9039,3251
Ranunculaceae,Aquilegia coerulea var. coerulea,8/15/2000,2000,8,15,228,Rocky near-alpine summit and wet areas around melting snowbank.,,,,,,fruiting,40.9228,-106.6884,3293
Ranunculaceae,Aquilegia coerulea var. coerulea,6/30/2001,2001,6,30,181,"Dry, alpine, scree slopes with Geum and Erigeron.",,,,,,flowering,40.5538,-105.9094,3354
Ranunculaceae,Aquilegia coerulea var. coerulea,7/27/2001,2001,7,27,208,South facing alpine ridges and slopes around and above the lakes with Geum and Sibbaldia.,,,,,,flowering,40.4768,-105.8796,3415
Ranunculaceae,Aquilegia coerulea var. coerulea,8/14/2001,2001,8,14,226,"Steep, east facing alpine talus slopes of granite and krummholz.",,,,,,flowering and fruiting,40.4887,-105.8868,3506
Ranunculaceae,Aquilegia coerulea var. coerulea,7/8/1981,1981,7,8,189,Knoll in upper basin; willowy area slightly below top of knoll.,,,,,,flowering,39.01805,-107.08926,3644
Ranunculaceae,Aquilegia coerulea var. coerulea,7/25/1983,1983,7,25,206,Rock ledge.,,,,,,flowering,37.79659,-107.55647,3782
Ranunculaceae,Aquilegia coerulea var. coerulea,7/13/2000,2000,7,13,195,Northeast-facing slope between mountains peaks at lower edges of alpine tundra.,,,,,,flowering,40.525278,-105.90205,3384
Ranunculaceae,Aquilegia coerulea var. coerulea,6/25/1996,1996,6,25,177,Southeast-facing alpine slopes.,,,,,,flowering,37.929167,-107.608167,3720
Ranunculaceae,Aquilegia coerulea var. coerulea,7/26/1986,1986,7,26,207,On tundra in rocks.,,,,,,flowering,40.3774,-105.6763,3537
Ranunculaceae,Aquilegia coerulea var. coerulea,8/1/1997,1997,8,1,213,Among talus.,,,,,,flowering,37.67197,-107.71416,3598
Ranunculaceae,Aquilegia coerulea var. coerulea,6/23/2000,2000,6,23,175,"Red arkose sandstone, conglomerate ss. siltstone and shale. In dry tundra and among boulders on gravelly bench at toe of Holocene and Pleistocene rock glaciers; with Festuca thurberi, Pentaphylloides floribunda, Juniperus communis, Rydbergia brandegei,",,,,,,flowering,38.13024,-105.71684,3592
Ranunculaceae,Aquilegia coerulea var. coerulea,7/12/1998,1998,7,12,193,Spruce-fir.,,,,,,flowering,38.0916,-105.6269,3476
Ranunculaceae,Aquilegia coerulea var. coerulea,7/16/1998,1998,7,16,197,Picea engelmannii/Pinus aristata and alpine on south-facing slope.,,,,,,flowering,38.4036,-106.241,3476
Ranunculaceae,Aquilegia coerulea var. coerulea,8/7/1998,1998,8,7,219,Alpine.,,,,,,flowering,37.9622,-105.5115,3354
Ranunculaceae,Aquilegia coerulea var. coerulea,8/10/1998,1998,8,10,222,Picea engelmannii and alpine.,,,,,,flowering,37.5694,-105.5042,3598
Ranunculaceae,Aquilegia coerulea var. coerulea,8/17/1998,1998,8,17,229,Alpine.,,,,,,flowering,37.9622,-105.5481,3598
Ranunculaceae,Aquilegia coerulea var. coerulea,7/5/1998,1998,7,5,186,Alpine meadow.,,,,,,flowering,37.9038,-105.0357,3415
Ranunculaceae,Aquilegia coerulea var. coerulea,7/24/1998,1998,7,24,205,Grassy alpine slopes.,,,,,,flowering,37.2944,-105.1639,3659
Ranunculaceae,Aquilegia coerulea var. coerulea,7/13/2010,2010,7,13,194,Upper subalpine-alpine rocky meadow.,,,,,,flowering,39.467,-105.9936,3366
Ranunculaceae,Aquilegia coerulea var. coerulea,7/17/2010,2010,7,17,198,"Rocky alpine meadow, snowmelt basins and ponds.",,,,,,flowering,39.0521,-106.7475,3591
Ranunculaceae,Aquilegia coerulea var. coerulea,7/19/2010,2010,7,19,200,"Alpine meadows, barrens, and snowdrifts.",,,,,,flowering,39.4932,-106.2533,3598
Ranunculaceae,Aquilegia coerulea var. coerulea,8/17/1999,1999,8,17,229,"Picea engelmannii, Abies lasiocarpa.",,,,,,flowering and fruiting,37.6083,-105.475,3232
Ranunculaceae,Aquilegia coerulea var. coerulea,7/26/2010,2010,7,26,207,Alpine meadow and talus slope.,,,,,,flowering and fruiting,39.4233,-106.1089,3683
Ranunculaceae,Aquilegia coerulea var. coerulea,7/31/2010,2010,7,31,212,Alpine talus slopes and rocky meadows.,,,,,,flowering,39.4627,-105.9364,3532
Ranunculaceae,Aquilegia coerulea var. coerulea,8/5/2010,2010,8,5,217,Rocky alpine meadows and talus slopes.,,,,,,flowering,39.4059,-105.9822,3515
Ranunculaceae,Aquilegia coerulea var. coerulea,8/7/2010,2010,8,7,219,Alpine meadows and talus slopes.,,,,,,flowering and fruiting,39.5118,-106.1111,3457
Ranunculaceae,Aquilegia coerulea var. coerulea,8/9/2010,2010,8,9,221,Upper subalpine and alpine meadow and talus slope.,,,,,,flowering,39.4903,-106.4544,3415
Ranunculaceae,Aquilegia coerulea var. coerulea,7/16/1999,1999,7,16,197,"Picea engelmannii, Abies lasiocarpa.",,,,,,flowering and fruiting,37.933,-105.4932,3354
Ranunculaceae,Aquilegia coerulea var. coerulea,7/16/1999,1999,7,16,197,Alpine.,,,,,,flowering,37.933,-105.5298,3835
Ranunculaceae,Aquilegia coerulea var. coerulea,7/18/1999,1999,7,18,199,Alpine.,,,,,,flowering,38.3484,-106.1483,3506
Ranunculaceae,Aquilegia coerulea var. coerulea,7/19/2011,2011,7,19,200,Subalpine spruce forest adjacent to an avalanche chute.,,,,,,flowering,39.111,-106.5875,3384
Ranunculaceae,Aquilegia coerulea var. coerulea,7/27/2011,2011,7,27,208,On or below limestone ridge.,,,,,,flowering,39.5251,-106.2551,3573
Ranunculaceae,Aquilegia coerulea var. coerulea,7/22/1999,1999,7,22,203,Alpine.,,,,,,flowering,38.0643,-105.5847,3963
Ranunculaceae,Aquilegia coerulea var. coerulea,8/2/2011,2011,8,2,214,Talus slope in alpine.,,,,,,flowering,38.9911,-107.0657,3451
Ranunculaceae,Aquilegia coerulea var. coerulea,8/16/2011,2011,8,16,228,Rocky alpine ridge and slopes.,,,,,,flowering,39.1047,-107.1125,3622
Ranunculaceae,Aquilegia coerulea var. coerulea,8/18/2011,2011,8,18,230,Alpine slopes.,,,,,,flowering,39.0387,-107.0086,3579
Ranunculaceae,Aquilegia coerulea var. coerulea,8/19/2011,2011,8,19,231,Alpine meadow.,,,,,,flowering,39.0483,-107.0372,3396
Ranunculaceae,Aquilegia coerulea var. coerulea,7/25/1999,1999,7,25,206,Picea engelmannii and Populus tremuloides.,,,,,,flowering,37.6093,-105.5131,3201
Ranunculaceae,Aquilegia coerulea var. coerulea,7/26/1999,1999,7,26,207,Picea engelmannii.,,,,,,flowering,37.9897,-105.6269,3415
Ranunculaceae,Aquilegia coerulea var. coerulea,7/23/2011,2011,7,23,204,"Alpine talus slopes, clearings, and rock crevices in limestone and granite.",,,,,,flowering,39.5219,-106.6305,3659
Ranunculaceae,Aquilegia coerulea var. coerulea,7/25/2011,2011,7,25,206,"Alpine meadows, rocky slopes, and talus fields.",,,,,,flowering,39.543,-106.1892,3598
Ranunculaceae,Aquilegia coerulea var. coerulea,8/1/2011,2011,8,1,213,"Alpine meadows, talus slopes, and rock crevices.",,,,,,flowering,39.657,-105.8834,3655
Ranunculaceae,Aquilegia coerulea var. coerulea,8/5/2011,2011,8,5,217,"Snowmelt basin with alpine meadows, talus slopes, and rock crevices.",,,,,,flowering,39.0185,-106.8553,3720
Ranunculaceae,Aquilegia coerulea var. coerulea,8/7/2011,2011,8,7,219,Alpine slopes and talus fields.,,,,,,flowering,39.0624,-106.5813,3567
Ranunculaceae,Aquilegia coerulea var. coerulea,8/7/2011,2011,8,7,219,Alpine slopes and talus fields.,,,,,,flowering,39.0624,-106.5813,3567
Ranunculaceae,Aquilegia coerulea var. coerulea,8/9/2011,2011,8,9,221,"Alpine ridge with exposed siltstone, granite cliffs, and talus slopes.",,,,,,flowering,39.1801,-107.0743,3579
Ranunculaceae,Aquilegia coerulea var. coerulea,8/12/2011,2011,8,12,224,Subalpine rocky meadow and snowmelt basin.,,,,,,flowering,39.0974,-107.1331,3354
Ranunculaceae,Aquilegia coerulea,8/10/2013,2013,8,10,222,Grassy meadows.,,Collected to mount and frame for Mrs. Weekley. Last few plants still in bloom in upper basin.,,,,Flowers,39.022413,-107.091108,3658
Ranunculaceae,Aquilegia coerulea,7/27/1995,1995,7,27,208,"SW facing slope, dry tundra",,"herbaceous, terrestrial, light green stems, dark green leaves, red-purple sepals, purple and white petals, yellow stamens.",,,,,39,-106.15,3630
Ranunculaceae,Aquilegia coerulea,7/22/1995,1995,7,22,203,"SE facing slope, bristlecone pine krummholz",,"herbaceous, terrestrial, reddish and green stems, dark green leaves, bluish outer perianth, pale yellow inner perianth, yellow stamens.",,,,,39,-106.15,3569
RANUNCULACEAE,Aquilegia coerulea,7/29/1965,1965,7,29,210,Spruce-fir stand,,Flowers blue,,,,,40.029781,-105.535625,3444
Ranunculaceae,Aquilegia caerulea,7/4/2015,2015,7,4,185,Growing among willows.,,,,,,Flower,39.76599,-107.3166,3252
Ranunculaceae,Aquilegia caerulea,7/3/2015,2015,6,27,178,Among willows near lake.,,,,,,Flower,39.77346,-107.29654,3237
RANUNCULACEAE,Pulsatilla patens,7/5/1948,1948,7,5,187,S slope,,,,,,Flower,38.983628,-106.975563,3658
RANUNCULACEAE,Pulsatilla patens,6/21/1975,1975,6,21,172,,,,,,,Flower,39.262747,-106.141046,3810
RANUNCULACEAE,Pulsatilla patens,6/22/1975,1975,6,22,173,,,,,,,Flower,39.148123,-105.766681,3353
RANUNCULACEAE,Pulsatilla patens,6/23/1975,1975,6,23,174,,,,,,,Flower,39.333373,-106.106376,3353
RANUNCULACEAE,Aquilegia coerulea,6/23/2000,2000,6,23,175,"Lower member of sangre de Cristo Form. Rec arkose sandstone, conglomerate ss. siltstone and shale. In dry tundra and among boulders on gravelly bench at to of Holocece anbd Pleistocene rock glaciers; occasional.",,"Flowers bi-coloured, blue and white.",,,,Flower,38.129938,-105.715701,3566
RANUNCULACEAE,Aquilegia caerulea,7/22/1968,1968,7,22,204,Alpine tundra in basin.,,,,,,,37.971167,-107.772549,3688
RANUNCULACEAE,Aquilegia caerulea,7/8/1981,1981,7,8,189,Knoll; willowy area slightly below top of knoll.,,,,,,Flower,39.020252,-107.086424,3652
RANUNCULACEAE,Aquilegia caerulea,8/8/1981,1981,8,8,220,"Disturbed area, along trail to mine cutting across talus slope.",,,,,,Flower,37.968356,-107.75874,3621
RANUNCULACEAE,Aquilegia caerulea,7/8/1981,1981,7,8,189,Series of ledges formed by talus and terraces; interrupted by several outcroppings and rivulets; crevices of rock.,,,,,,Flower,39.020252,-107.086424,3652
RANUNCULACEAE,Aquilegia caerulea,8/2/1984,1984,8,2,215,Tundra on S side of mountain near timberline.,,Shrub,,,,,39.336052,-106.106093,3612
RANUNCULACEAE,Aquilegia caerulea,7/11/1982,1982,7,11,192,Vegetated talus on S facing slope,,,,,,Flower,37.893329,-107.541046,3840
RANUNCULACEAE,Aquilegia caerulea,8/3/1982,1982,8,3,215,Dry ledge in timberline ecotone.,,,,,,Flower and Fruit,37.906313,-107.517167,3536
RANUNCULACEAE,Aquilegia caerulea,7/6/1981,1981,7,6,187,On steep (65%) slope down from saddle.,,,,,,Flower,39.020252,-107.086424,3798
RANUNCULACEAE,Aquilegia caerulea,7/10/1966,1966,7,10,191,Rock crevices and interstices of rock on slope.,,,,,,,40.397722,-105.702664,3219
RANUNCULACEAE,Aquilegia caerulea,7/25/1971,1971,7,25,206,Creek side.,,,,,,Flower,39.306393,-106.094248,3380
RANUNCULACEAE,Aquilegia caerulea,7/25/1971,1971,7,25,206,,,Woody and flat.,,,,,39.306393,-106.094248,3380
RANUNCULACEAE,Aquilegia caerulea,7/22/1968,1968,7,22,204,Alpine tundra in basin elevation.,,,,,,Flower and Fruit,37.971167,-107.772549,3688
RANUNCULACEAE,Aquilegia coerulea,6/22/2006,2006,6,22,173,Subalpine basin w/Picea engelmannii and Salix brachycarpa/S. planifolia.  Limestone,,,,,,,38.35157,-105.875181,3414
RANUNCULACEAE,Aquilegia coerulea,7/7/2007,2007,7,7,188,"Dry SE facing rock (volcanic) outcropping, due W of Sheep Mt",,,,,,,37.79119,-107.533931,3749
Ranunculaceae,Aquilegia coerulea,7/22/2011,2011,7,22,203,"Common species include Trifolium parryi, Polemonium viscosum, Androsace septentrionalis, Potentilla pulcherrima, Taraxacum officinale, Achillea millefolium, Elymus trachycaulus, Poa alpina, Achnatherum nelsonii, Carex ebenea, and Salix brachycarpa.",,,,,,,37.75777778,-107.7138889,3688
Ranunculaceae,Aquilegia coerulea,7/7/1993,1993,7,7,188,Kennebec Pass vicinity on the north side of Cumberland Mountain. Corkbark fir/Engelmann spruce community with Erigeron eximius habitat; 12% slope; NE aspect.,,,,,,,37.44738,-108.00278,3597
Ranunculaceae,Aquilegia coerulea,1893-06-24,1893,6,24,175,,,,,,,flowering,39.354971,-106.314599,3200
Roasaceae,Dryas octopetala,7/25/2004,4,7,25,207,,,,,,,,37.69637,-107.60212,3627
Rosaceae,Fragaria virginiana,8/9/1975,1975,8,9,221,Open moist meadow,,,,,,,38.97998,-107.03318,3383
Rosaceae,Fragaria virginiana,7/25/1986,1986,7,25,206,,,,,,,,38.98589,-106.78579,3850
Rosaceae,Fragaria virginiana,7/3/1967,1967,7,3,184,"Dry meadow, gravel",,,,,,,38.86515,-107.13324,3322
Rosaceae,Fragaria virginiana,7/7/1994,1994,7,7,188,Surrounding two small ponds; riparian.,,,,,,,37.4645,-108.0958,3341
Rosaceae,Fragaria virginiana,7/29/1998,1998,7,29,210,Engelmann spruce subalpine fir forest and drainages on SE slope.,,,,,,,38.7342,-107.1728,3475
Rosaceae,Fragaria virginiana,7/8/2003,2003,7,8,189,Spruce forest.,,,,,,flowering,37.5637,-106.5534,3390
Rosaceae,Fragaria virginiana,7/10/2003,2003,7,10,191,Deschampsia meadows and slopes with patches of Engelmann spruce.,,,,,,flowering,37.4928,-106.8002,3512
Rosaceae,Fragaria virginiana,7/13/2003,2003,7,13,194,Stony meadows.,,,,,,flowering,37.7076,-107.1416,3442
Rosaceae,Fragaria virginiana,7/17/2003,2003,7,17,198,Seep.,,,,,,flowering,37.7938,-107.3672,3843
Rosaceae,Fragaria virginiana,8/12/2003,2003,8,12,224,Roadside.,,,,,,fruiting,37.3528,-106.6873,3351
Rosaceae,Fragaria virginiana,7/5/2003,2003,7,5,186,Mesic spruce forest.,,,,,,flowering,37.61555,-106.843917,3476
Rosaceae,Fragaria virginiana,7/8/2003,2003,7,8,189,Roadside.,,,,,,flowering and fruiting,37.5458,-106.5534,3230
Rosaceae,Fragaria virginiana,7/10/2003,2003,7,10,191,Xeric open grazed meadow surrounded by dense spruce forest.,,,,,,flowering,37.6454,-106.8048,3415
Rosaceae,Fragaria virginiana,7/13/2003,2003,7,13,194,Spruce forest.,,,,,,flowering,37.8389,-106.6901,3480
Rosaceae,Fragaria virginiana,5/24/2004,2004,5,24,145,Aspen woodland and mixed conifer forest; large rock outcrops on 45 deg southwest-facing slope.,,,,,,flowering,37.4151,-106.3864,3262
Rosaceae,Fragaria virginiana,6/15/2004,2004,6,15,167,Spruce forest along creek into alpine.,,,,,,flowering,37.904,-106.5857,3415
Rosaceae,Fragaria virginiana,6/19/2004,2004,6,19,171,Rock outcrop into spruce forest on west-facing slope.,,,,,,flowering,37.907,-106.9018,3281
Rosaceae,Fragaria virginiana,6/24/2004,2004,6,24,176,Spruce forest with creeks on east-facing slope.,,,,,,flowering,37.2957,-106.5386,3420
Rosaceae,Fragaria virginiana,7/6/2004,2004,7,6,188,Spruce forest on an old closed logging road.,,,,,,flowering,37.4602,-106.4146,3419
Rosaceae,Fragaria virginiana,7/11/2004,2004,7,11,193,Rocky buttes on south-facing slope in spruce forest.,,,,,,flowering,37.8791,-106.7837,3422
Rosaceae,Fragaria virginiana,7/13/2004,2004,7,13,195,Spruce forest on southwest-facing slope.,,,,,,flowering,37.8294,-107.3363,3668
Rosaceae,Fragaria virginiana,7/14/2004,2004,7,14,196,Spruce and fir forest on north-facing slope.,,,,,,flowering,37.8829,-107.4844,3273
Rosaceae,Fragaria virginiana,7/25/2004,2004,7,25,207,Spruce/fir forest.,,,,,,flowering,37.6966,-106.9138,3276
Rosaceae,Fragaria virginiana,7/29/2004,2004,7,29,211,Spruce forest with scattered aspen and creek.,,,,,,fruiting,37.9623,-106.5541,3276
Rosaceae,Fragaria virginiana,7/29/2004,2004,7,29,211,"Old clear cut spruce forest with scattered aspen, bristlecone and limber pine on north-facing slope.",,,,,,flowering,37.9961,-106.4701,3338
Rosaceae,Fragaria virginiana,8/11/2004,2004,8,11,224,Open meadow and spruce forest surrounding lake.,,,,,,flowering,37.8459,-107.2362,3430
Rosaceae,Fragaria virginiana,7/16/2003,2003,7,16,197,Along trail and streams in alpine and subalpine.,,,,,,flowering,39.6474,-105.7992,3683
Rosaceae,Fragaria virginiana,7/19/2003,2003,7,19,200,Spruce/fir/lodgepole pine forest.,,,,,,flowering,40.0186,-105.6936,3207
Rosaceae,Fragaria virginiana,8/2/2003,2003,8,2,214,"Wet subalpine, lakeside, and rocky coniferous slopes.",,,,,,flowering,39.6017,-105.7522,3476
Rosaceae,Fragaria virginiana,6/23/2004,2004,6,23,175,Spruce/fir forest edge along creek.,,,,,,flowering,39.741,-105.8532,3317
Rosaceae,Fragaria virginiana,6/24/2001,2001,6,24,175,"Palustrine wetland at lake edge, surrounded by spruce-fir and willow.",,,,,,flowering,38.8335,-106.3592,3537
Rosaceae,Fragaria virginiana,7/4/2001,2001,7,4,185,"Treeline with bristlecone pine and above (alpine meadow), southwest aspect.",,,,,,flowering,38.7471,-106.3407,3537
Rosaceae,Fragaria virginiana,7/4/2001,2001,7,4,185,Spruce-fir forest.,,,,,,flowering,38.7327,-106.3592,3293
Rosaceae,Fragaria virginiana,7/14/1998,1998,7,14,195,Open spruce forest.,,,,,,flowering,37.9939,-107.2021,3488
Rosaceae,Fragaria virginiana,7/14/1998,1998,7,14,195,Open spruce forest.,,,,,,flowering,37.9361,-107.1655,3317
Rosaceae,Fragaria virginiana,7/16/1998,1998,7,16,197,Subalpine tundra with intermittent spruce glades.,,,,,,flowering,38.473,-106.2872,3402
Rosaceae,Fragaria virginiana,7/28/1998,1998,7,28,209,Steep north- and east-facing alpine slopes with intermittent open spruce forest at the lower elevation.,,,,,,flowering,37.9217,-107.5131,3476
Rosaceae,Fragaria virginiana,7/31/1998,1998,7,31,212,Alpine meadows into spruce forest.,,,,,,flowering,38.0373,-106.9277,3488
Rosaceae,Fragaria virginiana,8/9/1998,1998,8,9,221,Spruce forest to alpine tundra with rock outcrops.,,,,,,flowering,38.0643,-107.4224,3491
Rosaceae,Fragaria virginiana,8/11/1998,1998,8,11,223,Mixed conifer/aspen forest to alpine.,,,,,,fruiting,38.2438,-106.8815,3329
Rosaceae,Fragaria virginiana,8/16/1998,1998,8,16,228,Forest and creekside.,,,,,,flowering,37.8783,-107.3667,3293
Rosaceae,Fragaria virginiana,8/19/1998,1998,8,19,231,Spruce forest and riparian.,,,,,,flowering and fruiting,38.1942,-107.4219,3256
Rosaceae,Fragaria virginiana,6/25/1998,1998,6,25,176,East-facing rim of alpine meadow.,,,,,,flowering,38.2234,-107.3468,3415
Rosaceae,Fragaria virginiana,7/7/1999,1999,7,7,188,Subalpine meadow.,,,,,,flowering,38.164,-107.4218,3402
Rosaceae,Fragaria virginiana,8/26/1999,1999,8,26,238,Canyon.,,,,,,flowering and fruiting,38.0079,-106.8911,3415
Rosaceae,Fragaria virginiana,8/4/1997,1997,8,4,216,Dry tundra.,,,,,,flowering,38.98483,-107.04437,3634
Rosaceae,Fragaria virginiana,7/14/1994,1994,7,14,195,"Alpine knoll and slope, with scattered subalpine spruce below and krummholz on slope sides, north-northeast facing slope.",,,,,,buds,37.70465,-107.95803,3608
Rosaceae,Fragaria virginiana,7/20/1994,1994,7,20,201,Alpine ridge and talus slope; south-southeast facing.,,,,,,buds,37.82791,-107.9532,3628
Rosaceae,Fragaria virginiana,7/31/1995,1995,7,31,212,Upper subalpine spruce-fir grading into an alpine ridge and talus slope; north to northwest face.,,,,,,flowering,37.73431,-108.05803,3755
Rosaceae,Fragaria virginiana,6/26/1998,1998,6,26,177,"Meadows, streamside, and slopes in spruce-fir-bristlecone pine forest.",,,,,,flowering,37.3311,-105.1467,3201
Rosaceae,Fragaria virginiana,7/3/1998,1998,7,3,184,Spruce-fir and riparian.,,,,,,flowering and fruiting,38.3333,-106.2083,3262
Rosaceae,Fragaria virginiana,7/12/1998,1998,7,12,193,Spruce-fir.,,,,,,flowering and fruiting,38.0916,-105.6269,3476
Rosaceae,Fragaria virginiana,7/16/1998,1998,7,16,197,Picea engelmannii and Pinus contorta.,,,,,,flowering and fruiting,38.3898,-106.241,3293
Rosaceae,Fragaria virginiana,8/2/1998,1998,8,2,214,Alpine and areas with Picea-Pinus contorta and Pinus aristata.,,,,,,flowering and fruiting,38.5024,-106.3415,3537
Rosaceae,Fragaria virginiana,8/10/1998,1998,8,10,222,Picea engelmannii and alpine.,,,,,,flowering and fruiting,37.5694,-105.5042,3598
Rosaceae,Fragaria virginiana,7/9/1998,1998,7,9,190,Peat-like soil; spruce forest and stream side.,,,,,,flowering and fruiting,37.3311,-105.2374,3460
Rosaceae,Fragaria virginiana,7/9/1998,1998,7,9,190,"Peat-like soils at lower elevations, granite chunks at higher elevations.",,,,,,flowering,37.3311,-105.2374,3460
Rosaceae,Fragaria virginiana,7/1/1998,1998,7,1,182,Woods and lower slopes.,,,,,,flowering,37.9038,-105.0357,3537
Rosaceae,Fragaria virginiana,7/5/1998,1998,7,5,186,Parkland adjacent to spruce forest.,,,,,,flowering,37.9184,-105.054,3354
Rosaceae,Fragaria virginiana,7/24/1998,1998,7,24,205,Spruce/corkbark fir forest.,,,,,,flowering and fruiting,37.3019,-105.1467,3323
Rosaceae,Fragaria virginiana,7/13/2010,2010,7,13,194,Subalpine forest and openings.,,,,,,flowering,39.467,-105.9936,3366
Rosaceae,Fragaria virginiana,7/17/2010,2010,7,17,198,Dry rocky meadow and slopes.,,,,,,flowering,39.0732,-106.7705,3476
Rosaceae,Fragaria virginiana,7/19/2010,2010,7,19,200,Subalpine meadow and roadside and forest edges.,,,,,,flowering,39.4944,-106.2865,3506
Rosaceae,Fragaria virginiana,7/31/2010,2010,7,31,212,Subalpine riparian corridor through spruce-fir forest.,,,,,,flowering,39.4746,-105.9217,3232
Rosaceae,Fragaria virginiana,7/19/2011,2011,7,19,200,Avalanche chute in subalpine spruce forest.,,,,,,flowering,39.111,-106.5875,3384
Rosaceae,Fragaria virginiana,8/2/2011,2011,8,2,214,Upper subalpine meadow on south-facing slope.,,,,,,flowering,38.9911,-107.0657,3451
Rosaceae,Fragaria virginiana,8/19/2011,2011,8,19,231,Alpine meadow.,,,,,,flowering,39.0483,-107.0372,3396
Rosaceae,Fragaria virginiana,8/11/2011,2011,8,11,223,Subalpine rocky meadow with willows and forb understory.,,,,,,flowering,39.1035,-107.0742,3378
Rosaceae,Fragaria virginiana,8/17/2011,2011,8,17,229,Rocky slopes on either side of roadbed and old railroad grade.,,,,,,flowering,39.2645,-106.5144,3430
Rosaceae,Dryas octopetala,8/9/2002,2002,8,9,221,"alpine tundra, limestone slope.",,,,,,,39.129444,-106.184722,3670
Rosaceae,Dryas octopetala,8/9/2002,2002,8,9,221,"alpine tundra, limestone slope.",,,,,,,38.768611,-106.3975,3660
Rosaceae,Dryas octopetala,7/8/2014,2014,7,8,189,Steep but well-vegetated. High elevation meadow/grassland.,,Resembles Caltha.,,,,Flowers,38.95888,-106.753171,3892
Rosaceae,Dryas octopetala,7/22/1995,1995,7,22,203,"Dry tundra, SE facing slope",,"terrestrial, herbaceous, matted plant, purple-tinted stem, green leaves darker above, green sepals with purplish tint, yellow petals, yellow anthers.",,,,,39,-106.15,3660
Rosaceae,Dryas octopetala,8/7/2010,2010,8,7,219,Talus and scree slopes above treeline.,,In fruit.  Common.,,,,,38.96131,-106.95718,3656
Rosaceae,Fragaria virginiana,8/14/2014,2014,7,19,200,"Roadside spring producing wet ditch with running water, spruce/fir forest.",Wet soil.,Flowers white.,,,,Flower,37.34491,-105.03351,3399
Rosaceae,Fragaria virginiana,7/3/2015,2015,6,27,178,Spruce/fir subalpine forest.,,,,,,Flower,39.77717,-107.28432,3237
Rosaceae,Fragaria virginiana,7/3/2015,2015,6,27,178,Among willows near lake.,,,,,,Flower,39.77346,-107.29654,3237
Rosaceae,Fragaria virginiana,7/3/2015,2015,6,27,178,Among willows near lake.,,Long red stolens.,,,,Flower,39.77346,-107.29654,3237
ROSACEAE,Dryas octopetala,7/29/1970,1970,7,29,210,,,,,,,Flower,39.599922,-105.723547,3658
ROSACEAE,Dryas octopetala,6/29/1971,1971,6,29,180,,,,,,,Flower and fruit,39.603788,-105.730518,3658
ROSACEAE,Dryas octopetala,8/4/1987,1987,8,4,216,"Disturbed limestone ojn tundra; adjacent to lake, S facing slope.",,,,,,Flower and fruit,39.188691,-106.173383,3749
ROSACEAE,Dryas octopetala,7/11/1948,1948,7,11,193,,,,,,,Flower,38.9984,-105.500278,3658
ROSACEAE,Dryas octopetala,8/18/1912,1912,8,18,231,,,,,,,Flower and fruit,38.9984,-105.500278,3658
ROSACEAE,Fragaria virginiana,7/5/1948,1948,7,5,187,S slope,,,,,,Flower,38.98348,-106.975789,3658
ROSACEAE,Dryas octopetala,6/27/1998,1998,6,27,178,Aspect: SE-facing Limestone scree. Circumarboreal distribution.,,Flowers white.,,,,Flower,39.118751,-106.503687,3688
ROSACEAE,Dryas octopetala,7/29/1998,1998,7,29,210,Engelmann spruce/subalpine fir krumholz and alpine tundra on northwest-facing slope,,,,,,Flower and fruit,38.734111,-107.173989,3566
ROSACEAE,Dryas octopetala,8/11/1995,1995,8,11,223,"Lower Ordovician Manitou Dolomite. Relatively well developed tundra on slope of less than 20 degrees just above timberline; scattered patches locally. Associates include Salix brachycarpa, Cerastium beeringianum, Achillea lanulosa, Carex elynoides, Trifolium dasyphyllum.",,Flowers white.,,,,Flower,39.492114,-106.131181,3658
ROSACEAE,Dryas octopetala,7/8/1981,1981,7,8,189,Knoll in Upper Basin; sloping grassy meadow slightly below top of knoll,,,,,,Flower and fruit,38.999869,-107.072396,3652
ROSACEAE,Dryas octopetala,7/8/1981,1981,7,8,189,Knoll in Upper Basin; sloping grassy meadow slightly below top of knoll,,,,,,Flower,38.999869,-107.072396,3652
ROSACEAE,Dryas octopetala,9/16/1981,1981,9,16,259,Dry meadow,,,,,,Flower and fruit,39.663604,-105.879203,3661
ROSACEAE,Dryas octopetala,7/12/1984,1984,7,12,194,Shrub tundra adjacent to mining road,,,,,,Flower,38.581709,-106.29816,3627
ROSACEAE,Dryas octopetala,7/11/2007,2007,7,11,192,"humic substrate, on steep-sloping embankment",,"low perennial, a few inches high, white flowers, forming a mat",,,,Flower,39.602253,-105.736815,3536
ROSACEAE,Dryas octopetala,6/22/2006,2006,6,22,173,"Dry,open site, Picea engelmannii treeline below lake. Limestone",,,,,,Flower,38.35157,-105.875181,3353
ROSACEAE,Fragaria virginiana,7/13/2009,2009,7,13,194,"On dry SE facing slope near timberline in ravine, with Acomastylis rossii, Cerastium beeringianum ssp. earlei, Antennaria media. Granitic substrate.",,Stoloniferous; flowers white; occasional.,,,,Flower,38.809381,-105.023818,3505
ROSACEAE,Fragaria virginiana,6/27/2009,2009,6,27,178,"Between willow carr and Picea engelmannii forest; associates include Pinus aristata, Erigeron simplex. Granitic substrate.",,Flowers white; occasional.,,,,Flower,38.811677,-105.032769,3518
ROSACEAE,Dryas octapetala,7/16/2009,2009,7,16,197,"Dense alpine turf community on boulder strewn slope; dominants include Kobresia myosuroides, Carex rupestris, Acomastylis rossii ssp. turbinata; associates include Poa arctica, Mertensia alpina. Granitic substrate. granitic substrate",,Dense mats bordering and draping over semi-buried boulders; petals white; common.,,,,Flower and fruit,38.827078,-105.027764,3804
ROSACEAE,Fragaria virginiana,7/24/1995,1995,7,24,205,"Precambrian quartz monzonite, adamellite, quartz substrate. Along trail next to creek where narrow Populus tremuloides forest zone borders riparian wetland zone; common and widespread.",,Plants stoloniferous; flowers white; fruits red.,,,,Flower,38.988224,-106.151173,3353
Rosaceae,Dryas octopetala,,,,,,Alpine meadows,,,,,,Flowering,39.10722,-106.60528,3636
Rosaceae,Dryas octopetala,10/13/2011,2011,10,13,286,"Alpine, along hillside in ditch-like conditions with willow, above tree-line",,,,,,FR,39.20926389,-106.1725861,3810
Salicaceae,Salix arctica,7/22/2013,,,,203,Alpine tundra,,"Rhizomatous, mat forming perennial",,,,flowering,37.370384,-106.688534,3862
Salicaceae,Salix arctica,7/23/1976,1976,7,23,205,Alpine zone.,,,,,,Flowering,39.46,-106.62,3598
Salicaceae,Salix arctica,7/29/1983,1983,7,29,210,,,,,,,Flowering,40.0514,-105.583,3476
Salicaceae,Salix arctica,1986-07-00,1986,7,0,,Alpine ridge.,,,,,,Flowering & Fruiting,39.0203,-106.755,3850
Salicaceae,Salix planifolia,1986-07-00,1986,7,0,,Alpine ridge.,,,,,,Sterile,39.0203,-106.755,3850
Salicaceae,Salix planifolia,7/16/1949,1949,7,16,197,SE slopes,,,,,,,40.0028,-105.2869,3200
Salicaceae,Salix planifolia,7/7/1964,1964,7,7,189,Bog,,,,,,,38.7982,-106.3887,3596
Salicaceae,Salix planifolia,6/23/1967,1967,6,23,174,,,,,,,,39.6158,-105.6429,3913
Salicaceae,Salix planifolia,7/6/1967,1967,7,6,187,,,,,,,,39.6368,-105.572,3581
Salicaceae,Salix planifolia,8/2/1945,1945,8,2,214,Moist meadow,,,,,,,37.326,-106.636,3505
Salicaceae,Salix planifolia,7/16/1987,1987,7,16,197,Loam soil of moist site,,,,,,,37.3733,-106.5376,3380
Salicaceae,Salix planifolia,8/16/1987,1987,8,16,228,E exposure,,,,,,,37.2283,-105.1545,3840
Salicaceae,Salix planifolia,6/12/1933,1933,6,12,163,,,,,,,,39.7978,-105.7767,3447
Salicaceae,Salix planifolia,6/26/1967,1967,6,26,177,Streambank,,,,,,,38.86515,-107.13324,3291
Salicaceae,Salix planifolia,9/3/1937,1937,9,3,246,,,,,,,,39.2308,-106.32312,3352
Salicaceae,Salix planifolia,9/3/1937,1937,9,3,246,,,,,,,,39.2308,-106.32312,3352
Salicaceae,Salix planifolia,7/12/1974,1974,7,12,193,Peat soil,,,,,,,40.6267,-105.8929,3328
Salicaceae,Salix planifolia,7/12/1974,1974,7,12,193,Peat soil,,,,,,,40.6267,-105.8929,3328
Salicaceae,Salix planifolia,7/14/1938,1938,7,14,195,,,,,,,,40.4221,-105.808,3277
Salicaceae,Salix planifolia,5/29/1937,1937,5,29,149,,,,,,,,40.4221,-105.808,3277
Salicaceae,Salix planifolia,1933-09-00,1933,9,0,,,,,,,,,40.4371,-105.778,3352
Salicaceae,Salix planifolia,8/13/1987,1987,8,13,225,Wet emadow,,,,,,,37.18377,-105.15254,3779
Salicaceae,Salix planifolia,7/15/1985,1985,7,15,196,Alluvium near treeline,,,,,,,39.0064,-106.9341,3444
Salicaceae,Salix planifolia,7/20/1986,1986,7,20,201,Ridge,,,,,,,39.0203,-106.7556,3850
Salicaceae,Salix planifolia,7/20/1986,1986,7,20,201,Ridge,,,,,,,39.0203,-106.7556,3850
Salicaceae,Salix planifolia,9/1/1971,1971,9,1,244,Marshy flats at beaver ponds,,,,,,,37.88716,-107.71742,3230
Salicaceae,Salix planifolia,7/26/1995,1995,7,26,207,Igneous rock and rocky soils.  Drainage towards Animas River.,,,,,,,37.7916,-107.5497,3837
Salicaceae,Salix arctica,7/4/2004,2004,7,4,186,Common in rocky soil of alpine tundra.,,,,,,,39.85444444,-105.6741667,3353
Salicaceae,Salix planifolia,6/22/2003,2003,6,22,173,At tree line on open ski slopes and through scattered spruce stands.,,,,,,,39.8021,-105.7839,3414
Salicaceae,Salix arctica,8/16/2004,2004,8,16,229,Wet flats at west finger of lake.,,,,,,,39.6054,-105.6366,3901
Salicaceae,Salix planifolia,8/22/1996,1996,8,22,235,Along an alpine stream in a dense Salix thicket with occasional openings.,,,,,,Phenology: Fruiting.,39.2962,-106.1538,3396
Salicaceae,Salix planifolia,8/29/1996,1996,8,29,242,Along the rocky banks of an alpine stream.,,,,,,Phenology: Vegetative.,39.3251,-106.1353,3621
Salicaceae,Salix planifolia,8/29/1996,1996,8,29,242,On moist soils in Salix thicket at edge of Engelmann spruce stand.,,,,,,Phenology: Vegetative.,39.3107,-106.1168,3402
Salicaceae,Salix planifolia,8/30/1996,1996,8,30,243,Along the banks of an alpine stream and adjacent grassy flats.,,,,,,Phenology: Fruiting.,39.2962,-106.1723,3695
Salicaceae,Salix planifolia,7/21/1988,1988,7,21,203,In willow bog dominated by Salix glauca and S. planifolia.,,,,,,fruiting,39.589,-105.6992,3537
Salicaceae,Salix planifolia,7/8/2003,2003,7,8,189,Willow thickets.,,,,,,fruiting,37.5637,-106.5534,3390
Salicaceae,Salix planifolia,8/3/2003,2003,8,3,215,Mesic meadow with scattered spruce on subalpine slopes.,,,,,,vegetative,37.4348,-106.6091,3488
Salicaceae,Salix planifolia,8/12/2003,2003,8,12,224,Alpine meadow with alpine lake.,,,,,,fruiting,37.363,-106.6701,3351
Salicaceae,Salix planifolia,7/5/2003,2003,7,5,186,Willow carrs.,,,,,,fruiting,37.61555,-106.843917,3476
Salicaceae,Salix planifolia,6/26/2003,2003,6,26,177,Rocky slopes and benches with willow thickets.,,,,,,fruiting,37.713583,-107.345833,3913
Salicaceae,Salix planifolia,6/15/2004,2004,6,15,167,Spruce forest along creek into alpine.,,,,,,flowering and fruiting,37.904,-106.5857,3415
Salicaceae,Salix planifolia,6/15/2004,2004,6,15,167,Mountain summit in alpine and rock outcrops.,,,,,,flowering and fruiting,37.9366,-106.5993,3762
Salicaceae,Salix planifolia,6/19/2004,2004,6,19,171,Alpine meadow.,,,,,,flowering and fruiting,37.901,-106.8756,3599
Salicaceae,Salix planifolia,6/24/2004,2004,6,24,176,Creek.,,,,,,flowering and fruiting,37.2957,-106.5386,3420
Salicaceae,Salix planifolia,6/24/2004,2004,6,24,176,Subalpine meadow.,,,,,,flowering and fruiting,37.2957,-106.5386,3420
Salicaceae,Salix planifolia,6/24/2004,2004,6,24,176,Alpine peak summit.,,,,,,flowering,37.2959,-106.5726,4016
Salicaceae,Salix planifolia,7/5/2004,2004,7,5,187,Seep and open mesic meadow.,,,,,,flowering and fruiting,37.4602,-106.4146,3419
Salicaceae,Salix planifolia,7/5/2004,2004,7,5,187,Subalpine south southwest-facing slope with some rocky outcrops.,,,,,,flowering and fruiting,37.4602,-106.4146,3419
Salicaceae,Salix planifolia,7/11/2004,2004,7,11,193,Spruce forest onto a west southwest-facing slope of subalpine into alpine meadow.,,,,,,flowering and fruiting,37.9013,-106.7846,3832
Salicaceae,Salix planifolia,7/13/2004,2004,7,13,195,Alpine saddle below peak.,,,,,,flowering and fruiting,37.8356,-107.3471,3837
Salicaceae,Salix planifolia,7/13/2004,2004,7,13,195,Mesic meadow and lakeshore.,,,,,,flowering and fruiting,37.814,-107.342,3580
Salicaceae,Salix planifolia,7/14/2004,2004,7,14,196,Spruce and fir forest on north-facing slope.,,,,,,vegetative,37.8829,-107.4844,3273
Salicaceae,Salix planifolia,7/17/2004,2004,7,17,199,Alpine lake up a southwest-facing 35 deg slope.,,,,,,flowering and fruiting,37.7114,-107.528,3701
Salicaceae,Salix planifolia,7/25/2004,2004,7,25,207,Subalpine mesic meadow in willow carr.,,,,,,flowering and fruiting,37.6708,-106.9152,3515
Salicaceae,Salix planifolia,8/11/2004,2004,8,11,224,Open meadow and spruce forest surrounding lake.,,,,,,flowering and fruiting,37.8459,-107.2362,3430
Salicaceae,Salix planifolia,8/16/2004,2004,8,16,229,Subalpine mesic meadow with lakes and streams.,,,,,,vegetative,37.1125,-106.5181,3523
Salicaceae,Salix planifolia,7/9/2004,2004,7,9,191,Rocky slopes.,,,,,,flowering and fruiting,37.7311,-107.5086,3659
Salicaceae,Salix planifolia,6/22/2003,2003,6,22,173,At tree line on open ski slopes and through scattered spruce stands.,,,,,,flowering and fruiting,39.8021,-105.7839,3415
Salicaceae,Salix planifolia,6/22/2003,2003,6,22,173,At tree line on open ski slopes and through scattered spruce stands.,,,,,,fruiting,39.8021,-105.7839,3415
Salicaceae,Salix planifolia,6/27/2003,2003,6,27,178,Subalpine to alpine ridges and peak.,,,,,,flowering and fruiting,39.6701,-105.8637,3567
Salicaceae,Salix planifolia,6/27/2003,2003,6,27,178,Subalpine spruce and marsh to alpine ridges and peak.,,,,,,flowering and fruiting,39.5978,-105.7313,3537
Salicaceae,Salix planifolia,7/10/2003,2003,7,10,191,Alpine.,,,,,,flowering and fruiting,39.9175,-105.6822,3390
Salicaceae,Salix planifolia,7/15/2003,2003,7,15,196,Along stream and in wet subalpine meadow.,,,,,,fruiting,39.7767,-105.8879,3500
Salicaceae,Salix planifolia,7/19/2003,2003,7,19,200,Spruce/fir/lodgepole pine forest.,,,,,,fruiting,40.0186,-105.6936,3207
Salicaceae,Salix planifolia,7/19/2003,2003,7,19,200,Along stream and wet meadows in subalpine.,,,,,,fruiting,40.0186,-105.6936,3207
Salicaceae,Salix planifolia,7/24/2003,2003,7,24,205,Rocky granite western slope into wet meadow and lakeside.,,,,,,fruiting,40.0761,-105.6354,3329
Salicaceae,Salix planifolia,7/24/2003,2003,7,24,205,Rocky granite western slope into wet meadow and lakeside.,,,,,,fruiting,40.0761,-105.6354,3329
Salicaceae,Salix planifolia,8/2/2003,2003,8,2,214,"Wet subalpine, lakeside, and rocky coniferous slopes.",,,,,,fruiting,39.6017,-105.7522,3476
Salicaceae,Salix planifolia,8/4/2004,2004,8,4,217,Subalpine/alpine transition dominated by Salix ssp.,,,,,,vegetative,39.5901,-105.69,3506
Salicaceae,Salix planifolia,8/5/2004,2004,8,5,218,Wet meadow adjacent to stream and spruce stands.,,,,,,vegetative,39.675,-105.9072,3476
Salicaceae,Salix planifolia,8/6/2004,2004,8,6,219,Alpine drainage and stream.,,,,,,vegetative,39.7361,-105.7482,3506
Salicaceae,Salix planifolia,8/25/2004,2004,8,25,238,Adjacent to stream above treeline.,,,,,,vegetative,40.1337,-105.6733,3293
Salicaceae,Salix planifolia,6/23/2004,2004,6,23,175,Along creek.,,,,,,vegetative,39.741,-105.8532,3317
Salicaceae,Salix planifolia,6/27/2000,2000,6,27,179,Open grassland with Salix near stream.,,,,,,Phenology: Fruiting.,39.1073,-106.5608,3439
Salicaceae,Salix planifolia,7/15/2000,2000,7,15,197,Subalpine meadow.,,,,,,Phenology: Fruiting.,39.6601,-106.2589,3292
Salicaceae,Salix planifolia,7/18/2000,2000,7,18,200,Marshland with Picea engelmannii.,,,,,,Phenology: Fruiting.,39.5563,-106.2464,3414
Salicaceae,Salix planifolia,7/23/2000,2000,7,23,205,Alpine meadow and scree with scattered wetlands.,,,,,,Phenology: Fruiting.,38.9489,-106.431,3750
Salicaceae,Salix planifolia,7/29/2000,2000,7,29,211,"Alpine meadow and scree slope, southwest aspect.",,,,,,Phenology: Fruiting.,39.1806,-106.4687,3719
Salicaceae,Salix planifolia,7/31/2000,2000,7,31,213,Subalpine meadow with willows.,,,,,,Phenology: Fruiting.,39.224,-106.1908,3597
Salicaceae,Salix planifolia,6/15/2000,2000,6,15,167,"Mixed conifer (Pinus contorta, Picea engelmannii, Abies bifolia).",,,,,,Phenology: Fruiting.,39.1373,-106.6353,3292
Salicaceae,Salix planifolia,6/21/2000,2000,6,21,173,Willow stream/lakeside with mixed conifers.,,,,,,Phenology: Fruiting.,38.5588,-106.3234,3292
Salicaceae,Salix planifolia,6/21/2000,2000,6,21,173,Willow stream/lakeside with mixed conifers.,,,,,,Phenology: Flowering and Fruiting.,38.5588,-106.3234,3292
Salicaceae,Salix planifolia,6/26/2000,2000,6,26,178,Subalpine meadows and woodlands.,,,,,,Phenology: Fruiting.,39.1662,-106.2094,3262
Salicaceae,Salix planifolia,6/24/2001,2001,6,24,175,"Palustrine wetland at lake edge, surrounded by spruce-fir and willow.",,,,,,flowering and fruiting,38.8335,-106.3592,3537
Salicaceae,Salix planifolia,6/30/2001,2001,6,30,181,Lacustrine wetland surrounded by spruce-fir forest.,,,,,,flowering and fruiting,39.5128,-106.5247,3354
Salicaceae,Salix planifolia,7/1/2001,2001,7,1,182,Lacustrine wetland surrounded by spruce-fir and some willow.,,,,,,flowering and fruiting,39.5562,-106.5062,3445
Salicaceae,Salix planifolia,7/3/2001,2001,7,3,184,"Beaver pond with willows, palustrine wetland.",,,,,,flowering and fruiting,38.992,-106.1552,3232
Salicaceae,Salix planifolia,7/3/2001,2001,7,3,184,"Beaver pond with willows, palustrine wetland.",,,,,,flowering and fruiting,38.992,-106.1552,3232
Salicaceae,Salix planifolia,7/19/2001,2001,7,19,200,Spruce forest around a palustrine wetland (small lake).,,,,,,vegetative,39.296,-106.4136,3415
Salicaceae,Salix planifolia,7/19/2001,2001,7,19,200,"Subalpine meadow with krummholz and alpine turf, south aspect.",,,,,,flowering and fruiting,39.296,-106.4321,3415
Salicaceae,Salix planifolia,7/19/2001,2001,7,19,200,"Palustrine wetland, small lake surrounded by spruce.",,,,,,vegetative,39.3249,-106.4136,3482
Salicaceae,Salix planifolia,7/28/2001,2001,7,28,209,Open subalpine meadow to spruce krummholz.,,,,,,flowering and fruiting,39.0784,-106.6003,3354
Salicaceae,Salix planifolia,8/3/2001,2001,8,3,215,Willow carr and spruce krummholz.,,,,,,vegetative,38.92,-106.285,3659
Salicaceae,Salix planifolia,8/20/2001,2001,8,20,232,Talus slope with some alpine turf.,,,,,,flowering and fruiting,39.3393,-106.1358,3720
Salicaceae,Salix planifolia,7/25/1989,1989,7,25,206,Alpine.,,,,,,Phenology: not specified.,40.6625,-106.6635,3414
Salicaceae,Salix planifolia,7/11/1997,1997,7,11,192,"Engelmann spruce/subalpine fir forest and wet basin; Salix, juniper.",,,,,,Phenology: Fruiting.,38.992,-106.9341,3323
Salicaceae,Salix planifolia,7/11/1997,1997,7,11,192,Wet basin; Salix.,,,,,,Phenology: Flowering.,38.992,-106.9341,3414
Salicaceae,Salix planifolia,7/11/1997,1997,7,11,192,Wet basin; Salix.,,,,,,Phenology: Flowering.,38.992,-106.9341,3414
Salicaceae,Salix planifolia,8/8/1998,1998,8,8,220,"Alpine tundra, spruce krummholz and wet basin; on limestone.",,,,,,Phenology: Vegetative.,38.6528,-106.6295,3475
Salicaceae,Salix planifolia,8/9/1998,1998,8,9,221,Engelmann spruce/subalpine fir krummholz along creek.,,,,,,Phenology: Vegetative.,38.679,-106.5623,3262
Salicaceae,Salix planifolia,8/18/1998,1998,8,18,230,Subalpine avalanche meadow.,,,,,,Phenology: Vegetative.,38.9488,-107.101,3414
Salicaceae,Salix planifolia,6/12/1998,1998,6,12,163,Lodgepole pine/Engelmann spruce/subalpine fir forest near creek.,,,,,,Phenology: Flowering.,38.7759,-106.8043,3201
Salicaceae,Salix planifolia,7/8/1998,1998,7,8,189,Engelmann spruce/subalpine fir forest between mountains.,,,,,,Phenology: Flowering.,38.8191,-106.6559,3475
Salicaceae,Salix planifolia,7/9/1998,1998,7,9,190,Wet meadow.,,,,,,Phenology: Vegetative.,38.92,-106.7116,3414
Salicaceae,Salix planifolia,7/18/1998,1998,7,18,199,Alpine tundra on ridge.,,,,,,Phenology: Fruiting.,38.992,-106.6003,3597
Salicaceae,Salix planifolia,7/18/1998,1998,7,18,199,Alpine tundra and Engelmann spruce/subalpine fir and willow krummholz.,,,,,,Phenology: Fruiting.,39.0352,-106.6745,3536
Salicaceae,Salix planifolia,7/29/1998,1998,7,29,210,Engelmann spruce krummholz and alpine tundra on east-facing slope.,,,,,,Phenology: Vegetative.,38.7196,-107.1914,3567
Salicaceae,Salix planifolia,7/29/1998,1998,7,29,210,Alpine tundra; south-facing slope.,,,,,,Phenology: Vegetative.,38.7039,-107.1567,3597
Salicaceae,Salix planifolia,7/30/1998,1998,7,30,211,Engelmann spruce forest along creek.,,,,,,Phenology: Vegetative.,38.7039,-107.1381,3353
Salicaceae,Salix planifolia,7/11/1994,1994,7,11,192,In boggy spruce-fir forest.,,,,,,Phenology: Flowering and Fruiting.,37.9009,-108.2326,3292
Salicaceae,Salix planifolia,7/21/1994,1994,7,21,202,Wet tundra.,,,,,,Phenology: Flowering and Fruiting.,37.9506,-107.7692,3998
Salicaceae,Salix planifolia,8/6/1994,1994,8,6,218,Lake.,,,,,,Phenology: Vegetative.,37.8284,-107.866,3597
Salicaceae,Salix planifolia,8/11/1994,1994,8,11,223,Spruce-fir forest and wetlands (open wet meadows).,,,,,,Phenology: Flowering and Fruiting.,37.8574,-108.141,3597
Salicaceae,Salix planifolia,7/28/1998,1998,7,28,209,Steep north- and east-facing alpine slopes with intermittent open spruce forest at the lower elevation.,,,,,,fruiting,37.9217,-107.5131,3476
Salicaceae,Salix planifolia,8/9/1998,1998,8,9,221,Spruce forest to alpine tundra with rock outcrops.,,,,,,fruiting,38.0643,-107.4224,3491
Salicaceae,Salix planifolia,8/3/1999,1999,8,3,215,Alpine tundra and streams.,,,,,,flowering and fruiting,37.9212,-107.4767,3659
Salicaceae,Salix planifolia,7/7/1994,1994,7,7,188,Engelman spruce-subalpine fir area surrounding two small ponds; varies from spruce understory to riparian surrounding ponds.,,,,,,Phenology: Flowering and Fruiting.,37.4645,-108.0958,3280
Salicaceae,Salix planifolia,7/26/1994,1994,7,26,207,"Subalpine and alpine cirque basin, talus slopes and willow thicket. West facing.",,,,,,Phenology: Flowering and Fruiting.,37.8429,-108.031,3396
Salicaceae,Salix planifolia,8/12/1995,1995,8,12,224,Subalpine spruce fir forest and meadow area dominated by Geum rossii and Artemesia scopulorium; west facing.,,,,,,Phenology: Vegetative.,37.7199,-107.8989,3414
Salicaceae,Salix planifolia,7/16/2001,2001,7,16,197,Marshy meadows ascending north in spruce- fir subalpine forest.,,,,,,fruiting,40.5332,-105.8633,3232
Salicaceae,Salix planifolia,7/20/2001,2001,7,20,201,Subalpine spruce-fir slopes transitioning into east facing Krummholz slopes.,,,,,,fruiting,40.6802,-105.9489,3262
Salicaceae,Salix planifolia,7/26/2001,2001,7,26,207,East facing alpine scree slopes with Geum and Engelmann spruce krummholz.,,,,,,fruiting,40.6191,-105.9058,3354
Salicaceae,Salix planifolia,8/3/2001,2001,8,3,215,Subalpine creek crossing with Sibbaldia and Salix and subalpine meadow.,,,,,,fruiting,40.5939,-105.7232,3232
Salicaceae,Salix planifolia,7/31/2000,2000,7,31,213,Lake shore and slopes.,,,,,,fruiting,40.4741,-105.9039,3251
Salicaceae,Salix planifolia,8/8/2000,2000,8,8,221,Rocky slopes.,,,,,,vegetative,40.561,-105.9229,3354
Salicaceae,Salix planifolia,8/4/2001,2001,8,4,216,Subalpine meadows with margins of lodgepole and limber pine and Engelmann spruce.,,,,,,vegetative,40.7922,-106.1337,3238
Salicaceae,Salix planifolia,7/7/1964,1964,7,7,189,Abundant on 5% northeast slope in peat; also growing in boggy sites.,,,,,,flowering and fruiting,38.82179,-106.40371,3598
Salicaceae,Salix planifolia,7/29/2000,2000,7,29,211,Wet meadow with S. wolfii.,,,,,,vegetative,37.93,-107.16,3323
Salicaceae,Salix planifolia,8/12/2002,2002,8,12,224,Wet meadow with Salix wolfii.,,,,,,buds,37.406667,-106.645,3567
Salicaceae,Salix planifolia,8/12/2002,2002,8,12,224,Alpine slope with Salix brachycarpa.,,,,,,vegetative,37.398333,-106.673333,3689
Salicaceae,Salix planifolia,8/17/1942,1942,8,17,229,Plentiful on 30% north slope in clay loam and moist sites at high elevation with willows.,,,,,,vegetative,38.79167,-106.34682,3628
Salicaceae,Salix planifolia,6/26/1990,1990,6,26,177,Occasional in vast thickets of Salix glauca.,,,,,,Phenology: not specified.,40.1422,-107.0884,3323
Salicaceae,Salix planifolia,7/28/1990,1990,7,28,209,"Forest around lake, with subalpine fir, Engelmann spruce, and whortleberry.",,,,,,Phenology: not specified.,39.9206,-107.1552,3323
Salicaceae,Salix planifolia,7/29/1990,1990,7,29,210,Salix thickets.,,,,,,Phenology: not specified.,39.8769,-107.1552,3506
Salicaceae,Salix planifolia,7/2/1991,1991,7,2,183,Wet area below melting snow.,,,,,,Phenology: not specified.,40.0096,-107.0884,3597
Salicaceae,Salix planifolia,7/3/1991,1991,7,3,184,"Forest around lakeshore, subalpine fir, Engelmann spruce.",,,,,,Phenology: not specified.,39.9933,-107.0988,3353
Salicaceae,Salix planifolia,7/11/1991,1991,7,11,192,"West base of ultimate peak, with willows.",,,,,,Phenology: not specified.,39.9642,-107.1364,3658
Salicaceae,Salix planifolia,8/9/1991,1991,8,9,221,Extensive willow thickets.,,,,,,Phenology: not specified.,39.8915,-107.1929,3292
Salicaceae,Salix planifolia,6/26/1998,1998,6,26,177,"Meadows, streamside, and slopes in spruce-fir-bristlecone pine forest.",,,,,,flowering and fruiting,37.3311,-105.1467,3201
Salicaceae,Salix planifolia,7/3/1998,1998,7,3,184,Spruce-fir and riparian.,,,,,,fruiting,38.3333,-106.2083,3262
Salicaceae,Salix planifolia,7/12/1998,1998,7,12,193,Spruce-fir.,,,,,,fruiting,38.0916,-105.6269,3476
Salicaceae,Salix planifolia,7/12/1998,1998,7,12,193,Spruce-fir.,,,,,,fruiting,38.0916,-105.6269,3476
Salicaceae,Salix planifolia,7/1/1998,1998,7,1,182,Subalpine.,,,,,,fruiting,37.8746,-105.0174,3506
Salicaceae,Salix planifolia,7/5/1998,1998,7,5,186,Alpine meadow and creek side.,,,,,,fruiting,37.9038,-105.0357,3476
Salicaceae,Salix planifolia,7/17/2010,2010,7,17,198,Subalpine riparian meadow.,,,,,,fruiting,39.722,-106.772,3476
Salicaceae,Salix planifolia,7/19/2010,2010,7,19,200,Upper subalpine rivulets and wet meadow.,,,,,,fruiting,39.4949,-106.2549,3537
Salicaceae,Salix planifolia,7/25/2010,2010,7,25,206,Riparian corridor and wet meadow terraces adjacent to waterfall.,,,,,,fruiting,39.3855,-106.0966,3476
Salicaceae,Salix planifolia,8/9/2010,2010,8,9,221,Upper subalpine and alpine meadow and talus slope.,,,,,,fruiting,39.4903,-106.4544,3415
Salicaceae,Salix planifolia,8/12/2010,2010,8,12,224,Subalpine fen.,,,,,,fruiting,39.389,-106.4918,3305
Salicaceae,Salix planifolia,7/16/1999,1999,7,16,197,Alpine.,,,,,,flowering and fruiting,37.933,-105.5298,3835
Salicaceae,Salix planifolia,7/19/2011,2011,7,19,200,Around the edge of willow thickets.,,,,,,fruiting,39.1089,-106.5711,3659
Salicaceae,Salix planifolia,7/19/2011,2011,7,19,200,Alpine ridge with areas of turf and gravelly patches.,,,,,,flowering and fruiting,39.115,-106.5692,3659
Salicaceae,Salix planifolia,8/23/2011,2011,8,23,235,Wet areas below melting snow field.,,,,,,fruiting,39.8039,-106.3981,3582
Salicaceae,Salix planifolia,8/16/2011,2011,8,16,228,Subalpine meadow.,,,,,,fruiting,39.1004,-107.1106,3317
Salicaceae,Salix planifolia,8/16/2011,2011,8,16,228,Subalpine meadow.,,,,,,vegetative,39.1004,-107.1106,3317
Salicaceae,Salix planifolia,8/19/2011,2011,8,19,231,Wet meadows/islands in shallow stream.,,,,,,vegetative,39.013,-107.0511,3232
Salicaceae,Salix planifolia,8/19/2011,2011,8,19,231,Wet meadows/islands in shallow stream.,,,,,,fruiting,39.013,-107.0511,3232
Salicaceae,Salix planifolia,7/25/2011,2011,7,25,206,"Moist, rocky subalpine meadows and talus fields.",,,,,,fruiting,39.5338,-106.1819,3415
Salicaceae,Salix planifolia,7/27/2011,2011,7,27,208,Subalpine lake ringed with peat moss.,,,,,,fruiting,39.4022,-106.6038,3212
Salicaceae,Salix planifolia,8/17/2011,2011,8,17,229,"Fens with peat moss and sedge meadows, bordered by spruce-fir forest.",,,,,,fruiting,39.2544,-106.5191,3399
Salicaceae,Salix planifolia,7/21/2010,2010,7,21,202,Alpine meadows and fellfields.,,,,,,fruiting,39.5349,-105.8323,3598
Salicaceae,Salix planifolia,7/19/2010,2010,7,19,200,Upper subalpine rivulets and wet meadow.,,,,,,fruiting,39.4949,-106.2549,3537
Salicaceae,Salix planifolia,7/24/1995,1995,7,24,205,On open slopes with occasional Engelmann spruce and bands of willow.,,,,,,Phenology: Flowering.,39.4118,-105.9686,3500
Salicaceae,Salix planifolia,7/31/1995,1995,7,31,212,On the banks of the stream and adjacent flats.,,,,,,Phenology: Fruiting.,38.7742,-105.0266,3207
Salicaceae,Salix planifolia,8/14/1995,1995,8,14,226,"Wet alpine slopes and bogs, with extensive Salix thickets.",,,,,,Phenology: Fruiting.,39.1217,-106.19,3353
Salicaceae,Salix planifolia,7/24/1996,1996,7,24,206,In lodgepole pine forest above the creek.,,,,,,Phenology: Vegetative.,39.4263,-105.913,3207
Salicaceae,Salix planifolia,8/1/1996,1996,8,1,214,"Grassy openings in alpine Salix wetlands, and in dense Salix thickets.",,,,,,Phenology: Vegetative.,39.1373,-106.1723,3548
Salicaceae,Salix planifolia,8/1/2004,2004,8,1,214,,,,,,,,37.606315,-107.61938,3383
Salicaceae,Salix arctica,7/22/2013,2013,7,22,203,Alpine tundra,,"Rhizomatous, mat forming perennial",,,,flowering,37.370384,-106.688534,3862
Salicaceae,Salix arctica,8/9/2002,2002,8,9,221,"alpine tundra, limestone slope.",,,,,,,38.768611,-106.3975,3660
Salicaceae,Salix planifolia,7/17/2014,2014,7,17,198,Roadside. Wet areas.,,"Shrubs ~2m tall. Female plant. Branches dark red-purple, waxy. Catkins precocious, not on leafy shoots, 3-4cm long. Capsules short, silky. Floral bracts dark purple-brown, long-hairy. Leaves glabrous, elliptic to narrowly oblanceolate, entire, acute, 4-5cm x 1.5-2cm. Petioles 5-6mm. Dominant willow at this locality.",,,,Fruits,39.033089,-107.077157,3347
Salicaceae,Salix planifolia,7/17/2014,2014,7,17,198,Rocky slopes.,,"Low shrub with dark, reddish-purple, glabrous twigs. Catkins precocious, not of leafy branches, relatively large, ~3cm. Capsules short-hairy with long, narrow, blackish and densely hairy bracts. Leaves up to 3cm long, with reddish petioles, glaucous below, dark green above. Sparse hairs on lower leaf surface. Leaves ~planar, not revolute, Lance elliptic with acute tips.",,,,Flowers & Fruits,39.03076,-107.08152,3383
Salicaceae,Salix arctica,7/28/1995,1995,7,28,209,Dry tundra,,"woody shrub, low-lying mat, green young shoots, light brown buds, white oubescent male catkins.",,,,,39.01667,-107.03333,3691
Salicaceae,Salix planifolia,8/5/1995,1995,8,5,217,"Spruce krummholz, SW slope",,"woody shrub, dark red-brown bark, green leaves dark on top and light on bottom, light green catkins.",,,,,39,-106.15,3599
Salicaceae,Salix planifolia,7/25/2011,2011,7,25,206,"At the junction of Hummocky fen and Willow carr.  Potentilla diversifolia, and Castilleja occidentalis.",,,,,,,39.598711,-105.713914,3557
Salicaceae,Salix planifolia,6/29/2012,2012,6,29,181,"Between carpark entrance and lake outlet along hwy CO 5 in ditch between road and fence; associates include D. grayana, D. exunquiculata, Draba aurea, Acomastylis rossii, Bistorta vivipara, Trifolium parryi, Rhodiola integrifolia, Salix brachycarpa, Psychrophylla leptosepala, Pedicularis groelandica; sprawling knee high plant; common and widespread.",,,,,,,39.59791,-105.640031,3917
Salicaceae,Salix planifolia,8/3/2012,2012,8,3,216,Willow carr.,,Twigs dark red. common.,,,,,39.598782,-105.713985,3548
Salicaceae,Salix planifolia,8/3/2012,2012,8,3,216,Drier hillside above wetland.,Gravelly.,,,,,,39.597314,-105.713946,3552
Salicaceae,Salix arctica,7/10/1980,1980,7,10,192,Tundra.,,,,,,,39.349631,-106.107826,3810
Salicaceae,Salix planifolia,8/5/2014,2014,8,5,217,Upper subalpine meadow in Salix spp. shrubland bounded by spruce forest.,,,,,,Vegetative,38.16792,-107.41869,3450
Salicaceae,Salix reticulata,8/18/2015,2015,8,18,230,"Alpine tundra; west-facing, 20° vegetated talus slope.",,Small colony.,,,,Fruit,38.07855,-107.40536,3805
Salicaceae,Salix planifolia,8/19/2015,2015,8,19,231,Subalpine meadow in drainage; along heavily used hiking trail to Uncompahgre Peak.,,Shrub to 4-feet all. New stem growth red.,,,,Fruit,38.06883,-107.43258,3627
SALICACEAE,Salix arctica,7/27/1935,1935,7,27,208,Moist grasslands,,,,,,,39.384162,-106.013543,3719
SALICACEAE,Salix arctica,8/1/1951,1951,8,1,213,,,,,,,Flower and fruit,39.661496,-105.877964,3658
SALICACEAE,Salix arctica,8/18/1912,1912,8,18,231,,,,,,,Fruit,38.981223,-105.016775,3658
SALICACEAE,Salix arctica,7/11/1948,1948,7,11,193,,,,,,,Flower,38.9984,-105.500278,3658
Salicaceae,Salix planifolia,5/25/1940,1940,5,25,146,"At timberline, in wet bog.",,,,,,,40.008897,-105.659598,3200
SALICACEAE,Salix arctica,8/13/1973,1973,8,13,225,"Amid moss on gravel near outlet, also found N of road.",,,,,,Fruit,39.596252,-105.641109,3658
SALICACEAE,Salix arctica,8/3/1970,1970,8,3,215,Above timberline,,,,,,Flower,40.083981,-105.598567,3414
SALICACEAE,Salix arctica,8/1/1951,1951,8,1,213,"Gentle, mossy slope near the lake",,,,,,,39.661522,-105.878139,3597
Salicaceae,Salix planifolia,7/14/1990,1990,7,14,195,Glacial alluvium substrate of late Pinedale origin. Forming dominant ground cover willow carr corridor along stream almost to forest boundary; widespread in ROMO subalpine wetlands.,,"Stems to 1m high, twigs glossy dark puple to black.",,,,,40.428705,-105.734463,3255
Salicaceae,Salix planifolia,6/26/1998,1998,6,26,177,"Large, open subalpine meadow; oroboreal distribution.",,,,,,,39.120778,-106.265579,3368
Salicaceae,Salix planifolia,8/22/1984,1984,8,22,235,Tundra on E side of lake.,,Shrub,,,,,38.899241,-107.120132,3555
Salicaceae,Salix planifolia,8/15/1995,1995,8,15,227,"Tundra avove lake, E facing slope.",,,,,,,38.899241,-107.120132,3627
Salicaceae,Salix planifolia,7/21/1983,1983,7,21,202,Tundra adjacent to pond.,,Shrub,,,,,37.793422,-107.547815,3840
SALICACEAE,Salix arctica,8/3/1984,1984,8,3,216,Moist meadow bordering kettle holes containing standing water.,,,,,,,39.281414,-106.189962,3990
SALICACEAE,Salix arctica,8/6/1981,1981,8,6,218,Bedrock outcrop and to south of summit.,,,,,,,37.930335,-107.734725,3997
SALICACEAE,Salix arctica,7/18/1983,1983,7,18,199,Moist rock-strewn meadow below talus of headwall of mountain.,,,,,,,37.794281,-107.554749,3901
SALICACEAE,Salix arctica,8/14/1984,1984,8,14,227,"Moist meadow, surrounded by talus.",,,,,,,38.991754,-107.045132,3450
SALICACEAE,Salix arctica,7/20/1982,1982,7,20,201,Fellfield on top of N facing rock outcrop.,,,,,,,37.899632,-107.541263,3780
SALICACEAE,Salix arctica,7/18/1982,1982,7,18,199,Wet meadow at edge of snowbank.,,,,,,,37.899632,-107.541263,3901
SALICACEAE,Salix arctica,8/5/1982,1982,8,5,217,Moist eldge on N facing slope.,,,,,,,37.906313,-107.517167,3886
SALICACEAE,Salix arctica,8/22/1982,1982,8,22,234,Patterned gound on W side of basin.,,,,,,,37.906313,-107.517167,3780
SALICACEAE,Salix arctica,6/22/2006,2006,6,22,173,Moist opening in Picea engelmannii. Limestone. With Salix reticulata.,,,,,,,38.351911,-105.87055,3322
Salicaceae,Salix planifolia,7/7/2007,2007,7,7,188,"Rolling volcanic tundra, Salix planifolia/S. brachycarpa carr",,,,,,,37.784042,-107.53405,3627
Salicaceae,Salix planifolia,7/14/2009,2009,7,14,195,"On wet bench steep at head of developing drainage; among boulder with mixed mesic vegetation; with Salix brachycarpa, Acomastylis rossi ssp. turbinata, Carex nova, Carex ebenea, Bistorta vivpara, Rhodiola integrifolia, Stellaria umbellata. Granitic substrate.",,10ft tall shrub; locally abundant.,,,,,38.821704,-105.037127,3651
Salicaceae,Salix planifolia,6/30/2009,2009,6,30,181,"On W facing slope at head of S facing drainage developing below rock cliffs and leading to reservoir #2; with Salix brachycarpa, Mertensia alpina. Granitic substrate.",,6ft. tall shrub with dark bark; common and widespread in willow carrs.,,,,,38.820095,-105.040189,3637
Salicaceae,Salix planifolia,7/22/1995,1995,7,22,203,"Precambrian quartz monzonite, adamellite, quartz substrate. Dominant shrub in extensive willow carr extending down N. trending tributary of Rough & Tumbling Creek.",,Plants at upper boundary of carr uniformly 2.5 - 3 ft. tall with herbaceous understory,,,,,38.995523,-106.142053,3688
Salicaceae,Salix planifolia,7/12/1974,1974,7,12,193,Abundant on peat soil with other Salix spp.,,Shrub approx 1 m tall; staminate,,,,,40.632405,-105.884044,3309
Scrophulariaceae,Mimulus guttatus,7/22/2003,2003,7,22,203,,,,,,,,37.79321,-107.54825,3810
Scrophulariaceae,Castilleja miniata,7/24/2004,2004,7,24,206,,,,,,,,37.71551,-107.56231,3291
Scrophulariaceae,Castilleja miniata,7/27/2009,2009,7,27,208,Talus slope,,,,,,,37.858167,-107.792167,3320
Scrophulariaceae,Mimulus guttatus,8/16/1991,1991,8,16,228,Herb; along stream; corollas bright yellow ,,,,,,,39.45,-106.05,3420
Scrophulariaceae,Castilleja miniata,8/10/1965,1965,8,10,222,Moist ground,,,,,,,40.0715,-105.6058,3319
Scrophulariaceae,Castilleja miniata,8/14/1960,1960,8,14,227,Pinus aristata,,,,,,,39.6467,-105.5866,3535
Scrophulariaceae,Castilleja miniata,6/15/1985,1985,6,15,166,Moist granitic gravelly soil on N-facing slope,,,,,,,37.0585,-106.3535,3230
Scrophulariaceae,Castilleja miniata,8/14/1985,1985,8,14,226,NE-facing slope,,,,,,,39.00916,-107.03765,3200
Scrophulariaceae,Castilleja miniata,7/12/1985,1985,7,12,193,Along roadside,,,,,,,38.69799,-106.45066,3535
Scrophulariaceae,Castilleja miniata,6/25/1984,1984,6,25,177,Summit of ridge,,,,,,,37.5833,-106.542,3322
Scrophulariaceae,Castilleja miniata,7/12/1982,1982,7,12,193,Talus on steep slope,,,,,,,37.8885,-107.52196,3840
Scrophulariaceae,Castilleja miniata,7/21/1972,1972,7,21,203,Rocky soil along stream on S-facing slope,,,,,,,39.4405,-106.0061,3600
Scrophulariaceae,Castilleja miniata,7/16/1954,1954,7,16,197,Open ground,,,,,,,38.7689,-105.0724,3230
Scrophulariaceae,Castilleja miniata,8/6/1978,1978,8,6,218,,,,,,,,38.4967,-106.325,3310
Scrophulariaceae,Mimulus guttatus,7/18/1986,1986,7,18,199,Wet meadow of S-facing slope,,,,,,,37.3733,-106.5376,3400
Scrophulariaceae,Mimulus guttatus,8/6/1945,1945,8,6,218,Edge of water along stream,,,,,,,37.1857,-106.5837,3352
Scrophulariaceae,Mimulus guttatus,8/2/1975,1975,8,2,214,Moist roadside,,,,,,,39.00147,-107.02284,3230
Scrophulariaceae,Mimulus guttatus,7/15/1967,1967,7,15,196,Wet marsh,,,,,,,38.86515,-107.13324,3200
Scrophulariaceae,Mimulus guttatus,8/24/1984,1984,8,24,237,Among rocks of Stream,,,,,,,37.5691,-106.5955,3353
Scrophulariaceae,Mimulus guttatus,8/17/1979,1979,8,17,229,"Small creeks, Sandy peaty soil",,,,,,,37.82672,-107.79469,3290
Scrophulariaceae,Castilleja miniata,7/4/1999,1999,7,4,185,Frequent in alpine zone.,,,,,,,39.904167,-105.9292,3444
Scrophulariaceae,Castilleja miniata,7/21/2007,2007,7,21,202,Common in alpine tundra.  In moist runnoff next to road.,,,,,,,39.3874,-106.0987,3578
Scrophulariaceae,Castilleja miniata,7/29/2012,2012,7,29,211,"Walked up road past gate through spruce-fir forest; follow road/stream WSW into central basin to fell-field, talus meadow below Crystal Peak at 11200 ft. Then collect along road and seeps down to upper constructed pond at 11000 ft.",,"Uncommon color variant. Bracts and calyces orange and yellow. Calyx appears cleft to ~base below, shallowly cleft above. Calyx more prominent than bracts. Somewhat matches description for C. linariifolia, but smaller corolla and found in higher habitats than C. linariifolia.",,,,In flower and fruit.,39.02986,-107.08412,3423
Scrophulariaceae,Castilleja miniata,8/22/1995,1995,8,22,234,Dry tundra,,"herbaceous, terrestrial, green stem and leaves, orange and green bracts.",,,,,39.01667,-107.03333,3691
Scrophulariaceae,Castilleja miniata,8/19/1995,1995,8,19,231,Moist alpine meadow,,"herbaceous, terrestrial, green stem and leaves, orange and green bracts.",,,,,39.01667,-107.03333,3508
Scrophulariaceae,Castilleja miniata,7/29/1995,1995,7,29,210,SE facing slope,,"herbaceous, terrestrial, gray-green stem and leaves, red-orange bracts.",,,,,39.01667,-107.03333,3386
Scrophulariaceae,Castilleja miniata,7/29/1995,1995,7,29,210,Along creek among willows,,"herbaceous, terrestrial, green stem and leaves, red-orange bracts.",,,,,39.01667,-107.03333,3386
Scrophulariaceae,Castilleja miniata,7/29/1995,1995,7,29,210,"Along creek, wet meadow",,"herbaceous, terrestrial, green stem and leaves, red-orange bracts.",,,,,39.01667,-107.03333,3538
Scrophulariaceae,Castilleja miniata,8/22/1995,1995,8,22,234,Dry tundra,,"herbaceous, terrestrial, green stem and leaves, orange and green bracts.",,,,,39.01667,-107.03333,3660
SCROPHULARIACEAE,Castilleja miniata,8/10/1973,1973,8,10,222,"Near summit on hillside that was logged off years ago - in talll grass, in widely scattered lumps.",,,,,,,39.409238,-105.968318,3499
SCROPHULARIACEAE,Castilleja miniata,7/30/1944,1944,7,30,212,,,,,,,,37.480612,-106.797703,3307
SCROPHULARIACEAE,Mimulus guttatus,7/30/1944,1944,7,30,212,,,,,,,,37.480612,-106.797703,3307
SCROPHULARIACEAE,Mimulus guttatus,7/31/1938,1938,7,31,212,Wet sand,,,,,,,39.359242,-106.0619,3353
SCROPHULARIACEAE,Mimulus guttatus,7/20/1997,1997,7,20,201,On steep shaded SE facing seep with moss and bog orchids. Soil; wet colluvial Morrison sedimentary loamy cryboralf.,,Fresh petals; orangish yellow. Height: 20 cm.,,,,,37.70989,-107.901251,3292
SCROPHULARIACEAE,Castilleja miniata,7/4/1999,1999,7,4,185,Alpine zone; frequent.,,Flowers red,,,,,39.90416,-105.92916,3444
SCROPHULARIACEAE,Mimulus guttatus,7/30/1999,1999,7,30,211,Moist Piea forest.,,,,,,,38.430421,-106.036928,3200
SCROPHULARIACEAE,Castilleja miniata,8/2/1984,1984,8,2,215,shrub tundra on south side of mountain near treeline,,,,,,,39.302172,-106.096571,3612
SCROPHULARIACEAE,Castilleja miniata,7/12/1982,1982,7,12,193,vegetated talus on steep slope,,,,,,,37.896085,-107.534398,3840
SCROPHULARIACEAE,Castilleja miniata,6/30/1981,1981,6,30,181,"in shade of wilows, roadside area",,,,,,,39.309726,-106.118043,3444
SCROPHULARIACEAE,Mimulus guttatus,7/9/1981,1981,7,9,190,seepy roadside bank,,,,,,,39.021474,-107.085109,3444
SCROPHULARIACEAE,Mimulus guttatus,8/19/1980,1980,8,19,232,"tundra, American Flats; mossy drainage",,,,,,,37.979034,-107.569102,3658
SCROPHULARIACEAE,Mimulus guttatus,7/30/1981,1981,7,30,211,seepy area adjacent to mine tailings,,,,,,,37.898323,-107.536351,3597
SCROPHULARIACEAE,Mimulus guttatus,7/24/1981,1981,7,24,205,seepy area of shrub tundra roadside,,,,,,,37.903842,-107.555305,3231
SCROPHULARIACEAE,Mimulus guttatus,7/20/1968,1968,7,20,202,south-facing slope near road and creek,,,,,,,37.995463,-107.798969,3383
SCROPHULARIACEAE,Castilleja miniata,7/23/1981,1981,7,23,204,Moist meadow below mine,,,,,,,37.857157,-107.370586,3719
SCROPHULARIACEAE,Castilleja miniata,8/11/1995,1995,8,11,223,"Lower Mississipian & Ordvician calcareous rocks including limestone, sandstone & dolomite. Gently sloping to flat, dry meadow, possible burn site, fine limey soil, not densely vegetated.",,Bracts red; cleft slightly deeper............,,,,,39.012041,-106.111134,3383
Scrophulariaceae,Castilleja miniata,7/27/1978,1978,7,27,208,Open meadow and among shrubs,,,,,,flowering and fruiting,37.99611,-107.77694,3353
